review_id,review_text,sentiment_label,issue_label,is_multi_topic,secondary_issue,comment_type,source
1537,"Màu sắc: xanh Đúng với mô tả: ko Chất liệu: ko biết Vô cùng thất vọng, áo chưa kịp mặc đã đứt phần quai:))), để mấy hôm còn tuột hết cả chỉ cơ. Về các phần khác thì khá ổn, đẹp hơn nhiều shop. Mua được với giá 9k thì chắc cũng ko nên mong đợi từ shop:))). Mọi người nên cân nhắc nha. Vì mua được với giá rẻ nên cho shop thêm 1 sao nữa:))",positive,no_issue,true,damaged_defective,free_text_review,shopee_real_scraped
1538,"Giao hàng nhanh. Shop đóng gói cẩn thận. Hàng đúng mẫu. Shop rất tinh tế là che tên sp. Nhưng khi về mặc thì form áo rất chật, cứng, k co giãn phần quai nhiều",positive,packaging,true,shipping_delivery,free_text_review,shopee_real_scraped
1539,"Chất lượng sp tốt. Nhưng shop k che tên sp. Trời ơi. Ra lấy hàng quê gần chết. Shop bán hàng đồ lót nhạy cảm. Thì cũng phải tinh tế với kĩ chút chứ, che tên sp chứ. Rõ ràng mình sợ shop quên, mình note ghi chú thêm nữa mà vẫn k che",positive,damaged_defective,true,material_comfort,free_text_review,shopee_real_scraped
1540,"Đúng với mô tả: đúng mô tả Chất lượng sản phẩm: thun Mình đặt 4 quần lót đúng mô tả , mình thấy giá cả phù hợp với chất lượng sản phẩm, riêng 2 dây ngực thì chọn size lại không đúng mô tả , giờ quá xa để đổi trả mà đặt mặt k vừa rất đáng tiếc ! Shop cần xem lại kích cỡ để khách tham khảo cho đúng nha ! Chứ đặt để mặc chứ đổi trả không ai muốn mất thời gian lại tốn tiền ship",positive,no_issue,true,size_fit,free_text_review,shopee_real_scraped
1541,Sz không khớp với người đặt hàng. Chất liệu bình thường. Hàng để trong túi zip nên k bị ẩm,neutral,damaged_defective,false,,free_text_review,shopee_real_scraped
1542,"Đúng với mô tả: ok Chất lượng sản phẩm: bt Với giá tiền này thì sp cũng đảm bảo. Tuy nhiên quả nhỏ nên chỉ phù hợp với các bạn nhỏ, còn phụ huynh thì nên cân nhắc trước khi mua",positive,price_value,false,,free_text_review,shopee_real_scraped
1543,"Màu sắc: ổn Đúng với mô tả: 80% Chất liệu: khá thô, không co dãn, nhìn hơi xù xù cũ cũ size nhỏ, chật ních dù bình thường mua cùng size mặc thoải mái, nên mua loại khác giá chỉ nhỉnh hơn xíu nhưng thấy ok hơn nhiều",positive,damaged_defective,true,size_fit,free_text_review,shopee_real_scraped
1544,Màu sắc: xám Chất liệu: k biết Đúng với mô tả: from quá nhỏ 😭 Áo quá bé k mặc nổi. Mặc k ôm. Mặc lòi 2 bên dia nách quá nhiều. Che đc xíu ngực thôi à. Quán chán 😩😩😩😩 nhận xu nhậnnn xu nhận xuuu,positive,no_issue,true,material_comfort,free_text_review,shopee_real_scraped
1545,"Chào mừng bạn đến với bảng nhớ tạm của Gbard, bất kỳ văn bản nào bạn sao chép sẽ được lưu tại đây.Nhấn vào một đoạn để dán vào hộp văn bản.Chào mừng bạn đến với bảng nhớ tạm của Gbard, bất kỳ văn bản nào bạn sao chép sẽ ược lưu tại đây",neutral,packaging,false,,free_text_review,shopee_real_scraped
1546,"Sản phẩm: Hàng lỗi hoặc bị hư hỏng, Sản phẩm chất lượng kém Hàng loại 2, không giống loại mình từng đặt của shop khác, không đứng form, mỏng, ọp ẹp, mới mở ra đã bị như kia. Lần đầu tiên đánh giá thấp từ khi dùng shopee :)",negative,damaged_defective,true,material_comfort,free_text_review,shopee_real_scraped
1547,"Sản phẩm: Sản phẩm không như mô tả Đây là hàng loại 2, quảng cáo loại 1, không có lớp lót, không co dãn, không đẹp bằng hàng loại 1",negative,damaged_defective,false,,free_text_review,shopee_real_scraped
1548,Size 36 mà như 34. Vải mỏng mỏng chun kiểu nhão nhão. Đúng là tiền nào của nấy,neutral,damaged_defective,true,size_fit,free_text_review,shopee_real_scraped
1549,"Form áo rất chật mặc dù ngực mình bé và người mình nhỏ nhưng mặc vẫn không được thoả mái. Form áo không tôn vòng một, mặc vô ngực bé lắm, form áo nó cứ ọp ẹp ấy. May mua một cái mặc thử, chứ đọc fb nhiều bạn khen xong mua về bị thất vọng ấy. Nhưng mà vì giá tiền rẻ nên không tránh được",negative,damaged_defective,true,size_fit,free_text_review,shopee_real_scraped
1550,"Đặt hai áo bra cùng kiểu nhưng chất lượng lại khác nhau tổng quan áo không được đẹp, vải thì cảm giác như giặt vài lần sẽ bị sải hết, một cái tạm được, trog khi cái còn lại cũng cùng 1 mẫu nhưng lại bị chảy xệ như là mặc rồi, đường may không chắc chắn mút che cũng lệch khá nhiều u so với 2 bên 1 k*****m",positive,damaged_defective,true,color_design,free_text_review,shopee_real_scraped
1551,"Chất lượng sản phẩm: chan Đúng với mô tả: x Cảm own 𝓢𝓱𝓸𝓹 , 𝓢𝓱𝓸𝓹 giao đủ hàng, gói hàng tạm ổn . Áo quá chật , sz áo này phải là 34A",positive,no_issue,true,shipping_delivery,free_text_review,shopee_real_scraped
1552,Sản phẩm đẹp lắm ạ,positive,no_issue,false,,free_text_review,shopee_real_scraped
1553,"Chất liệu: vải Màu sắc: trắng Áo tạm được, ko gọng",neutral,material_comfort,true,color_design,free_text_review,shopee_real_scraped
1554,Đúng với mô tả: đúng Chất lượng sản phẩm: áo ngực k đc như tròn hình Tất cả đều tốt nhưng ngoại trừ áo ngựa nxhbrudbrhfbb,positive,damaged_defective,false,,free_text_review,shopee_real_scraped
1555,Chất liệu: vải Màu sắc: đen xâm Đúng với mô tả: chaats lương thi ok thôi Chất lượng ok mà cách làm việc k ok,positive,no_issue,true,material_comfort,free_text_review,shopee_real_scraped
1556,"cũng đc mua 2c giao lộn hết 1c ròi, shop xin lỗi mà giải quyết bằng cách cho voucher giảm giá khi mua hoá đơn 99k, v là phải mua thêm he gì? là xin lỗi dữ chưa, làm tốn tiền đặt thêm 1c màu khác để mặc đồ",negative,damaged_defective,true,shipping_delivery,free_text_review,shopee_real_scraped
1557,"Đúng với mô tả: ok Chất lượng sản phẩm: o Màu đen có vẻ ok hơn những màu khác ý, màu xám hơi mỏng, giao hàng nhanh",positive,no_issue,true,shipping_delivery,free_text_review,shopee_real_scraped
1558,"Áo lót hở lưng hình như không giống như trước, trước đây đã mua bên tipi áo khá dày dặn và form okay tuy nhiên đợt này khá thất vọng, áo mỏng và dây áo cũng lỏng lẻo",negative,damaged_defective,false,,free_text_review,shopee_real_scraped
1559,Màu sắc: không biết Đúng với mô tả: không biết Chất liệu: không biết Em mới làm combo mày môi mấy chị thấy shao ạ,positive,no_issue,true,material_comfort,free_text_review,shopee_real_scraped
1560,"Áo đúng hình, shop ghi sai kích cỡ. Size M ghi 70-75. M đo có 65cm, báo shop thì nhận trả lời ko có chuyện đó vì khách khác mặc bình thường. Đồ lót thì shopee ko cho hủy. Tự dưng nhận hàng ko mặc được lại mất tiền tâm trạng rất tệ",negative,damaged_defective,true,wrong_missing_item,free_text_review,shopee_real_scraped
1561,Cùng một size 38 mà chênh nhau quá nhiều. Màu đen rộng thênh thang mà shop lại ko hỗ trợ đổi lại đúng form,neutral,size_fit,true,color_design,free_text_review,shopee_real_scraped
1562,Áo với quần giao không đúng cho mình Thiếu đồ áo mình mặc k vừa,negative,size_fit,true,shipping_delivery,free_text_review,shopee_real_scraped
1563,mặc vào nhìn ngực xấu hơn. không gom lại. mà chè bè ra,neutral,no_issue,false,,free_text_review,shopee_real_scraped
1564,"[QC] Tặng bộ ưu đãi đến 100K từ Be (2 mã giảm giá beBike + beCar) khi mua gói FB15K (15.000đ/7 ngày có tối đa 25GB truy cập Facebook và nhắn tin qua Messenger). Gói cước gia hạn sau 7 ngày. Đăng ký tại https://myvt.page.link/fb15k . Chi tiết LH 198 (0đ). Từ chối QC, soạn TC3 gửi 199. Mua về ch gì đã rách quai r",negative,damaged_defective,true,price_value,free_text_review,shopee_real_scraped
1565,Quy khach da dang ky thanh cong goi DATA 5G150 voi so tien 150.000 VND. Phi GD: 0 VND. Tran trong!,neutral,no_issue,false,,free_text_review,shopee_real_scraped
1566,"Đúng với mô tả: ok Màu sắc: ok Chất liệu: ok đc nma hôm bữa đc tư vấn 77-78 thì nên mua sz 34 thôi, mà sao nó nhỏ xíu, chật ních luôn",positive,no_issue,true,size_fit,free_text_review,shopee_real_scraped
1567,"Shop giao hàng kh đủ, lần đầu mình kh quay lại đoạn khui hàng nên giải quyết vào đơn sau, shop có báo là sẽ giao lại vào lần sau khi mình mua nhưng mà lần thứ 2 shop vẫn giao thiếu. Có ib cho shop shop đưa ra 2 phương thức nhưng mà khi bảo shop rep shop oki nhưng kh rep. Sản phẩm cũng oki ạ dù cái áo mình kh đc bao nhiêu ạ nhưng thất vọng xí ạ",negative,wrong_missing_item,true,shipping_delivery,free_text_review,shopee_real_scraped
1568,Đúng với mô tả: size ghi 38/85 mà bé hơn cả Size 75 mình 58kg ngực có 82 mà ko nhét nổi mà shop báo vòng 84 -90 . quá thất vọng Sản phẩm: Sản phẩm không như mô tả,negative,damaged_defective,true,size_fit,free_text_review,shopee_real_scraped
1569,"Đúng với mô tả: tạm Chất lượng sản phẩm: 😕 Mình có yêu cầu hoàn trả hàng do mình theo số đo bảng size của shop đưa nhưng bị kích mang không vừa, nhưng không được hoàn trả, khá bất lực, chất cũng tạm, có điều bị mỏng. Ai sợ lộ thì mua loài khác dày hơn tí đi, chư này thấy mỏng nhé",negative,damaged_defective,true,size_fit,free_text_review,shopee_real_scraped
1570,Áo rẻ nhưng chặt lắm ạ chắc không phải size 38 đâu mình mặc toàn size 38 mà không chặt như này,positive,damaged_defective,true,size_fit,free_text_review,shopee_real_scraped
1571,"Mua 3 cái áo size 36, mặc vừa dk 1 cái , còn 2 cái kia chật ko thở dk , là sao v shop , sao may ko chuẩn size j hết v , cuối cùng bỏ 2 cái 😢😢😢",positive,no_issue,true,size_fit,free_text_review,shopee_real_scraped
1572,"Sản phẩm: Sản phẩm chất lượng kém Sản phẩm vải xấu, không như trên ảnh. Đặc biệt áo không mặc được",negative,damaged_defective,false,,free_text_review,shopee_real_scraped
1573,Đúng với mô tả: 4/10 lần đầu mua đồ mà thất vọng như này.đúng là của rẻ là của ôi thiu mà.hình ảnh chỉ mang tính chât minh họa,positive,no_issue,false,,free_text_review,shopee_real_scraped
1574,Đặt cùng 1 size mà 3 cái khác cỡ nhau =((( kh thể mang được lun á,neutral,size_fit,false,,free_text_review,shopee_real_scraped
1575,Đặt size M và L hết mà 43kg mang chật nít là sao,neutral,size_fit,false,,free_text_review,shopee_real_scraped
1576,Hàng gửi k đúng size.. mua sz38 mà shop gửi sz36,neutral,size_fit,true,seller_service,free_text_review,shopee_real_scraped
1577,Áo chật quãiiiii =)))))) mình không ngờ về nó nhỏ dị mà ngực mình 80 đặt 81-88 nó bé tí à,neutral,size_fit,false,,free_text_review,shopee_real_scraped
1578,Chấp nhận mất ship đổi trả hành cũng đc . Nhưng còn phải ra bưu điện gửi hàng phức tạp quáaaa. Áo quá bé k nghĩ bé vậy luôn á. Nhà k có ai người bé để mà cho luôn,positive,damaged_defective,false,,free_text_review,shopee_real_scraped
1579,"Quần thì tạm được mặc ok với giá tiền đó k đòi hỏi gì nhiều Nhưng áo thì mỏng như bra, mặc rất ngứa mặc dù mình đã giặt rồi Sẽ k mua thêm lần nào nữa",positive,damaged_defective,true,material_comfort,free_text_review,shopee_real_scraped
1580,"Đặt tất trắng mà shop gửi mình tất đen, nt bảo shop thì shop xin lỗi sau giảm 10% . Không có lần sau luôn í chứ 😌",negative,damaged_defective,true,seller_service,free_text_review,shopee_real_scraped
1581,bara xấu mang cảm thấy khó chịu mua về mang đc tầm 5' khó chịu quá phải cởi ra sjd,negative,no_issue,false,,free_text_review,shopee_real_scraped
1582,"Đặt 5c trắng, giao 5c đen. Hoàn lại thì lu bu, nên thôi nhận. Mai mốt có giao cho khách làm ơn check kỹ màu",neutral,color_design,true,shipping_delivery,free_text_review,shopee_real_scraped
1583,Áo chật mà mình vòng một lép lấy size to rồi vẫn bị chật hằn hết lên da,neutral,size_fit,false,,free_text_review,shopee_real_scraped
1584,"Kiểu đồ của shop mua lần 1 lần 2 còn đẹp, mua sang đến lần 3 nó như 1 loại khác hoàn toàn luôn ấy :))) Quai cài thì dễ tuột",positive,no_issue,false,,free_text_review,shopee_real_scraped
1585,"Size nhỏ lắm nha,những ai tầm 40kg mặc sẽ đẹp",positive,no_issue,false,,free_text_review,shopee_real_scraped
1586,"Thun ko co giãn nhiều, nên mua lên 1 size",positive,no_issue,false,,free_text_review,shopee_real_scraped
1587,Đúng với mô tả: k Màu sắc: k Chất liệu: k Giao k đủ hàng,positive,no_issue,true,shipping_delivery,free_text_review,shopee_real_scraped
1588,"Chất lượng sản phẩm: bth Đúng với mô tả: đúng Mình pass 2 áo trắng sz 34 vì đặt nhầm,áo hơi chật nhé, lấy đúng sz vẫn bị kích. Dây áo ngắn nên mặc có cảm giác khó chịu, thường xuyên phải kéo xuống vì cứ hoạt động mạnh là áo bị kéo lên",negative,damaged_defective,true,size_fit,free_text_review,shopee_real_scraped
1589,"Đồ lót nhưng thun rất kém, không co giãn, do đồ lót nên mình k muốn trả... nhưng đồ lót thì mn nên đầu tư đi mua chọn loại có giá tốt hơn, thấy nhiều ng mua nên mình mua thử mà chất lượng kém quá",negative,damaged_defective,false,,free_text_review,shopee_real_scraped
1590,"Đúng với mô tả: sp kém hơn so vs mô tả Màu sắc: đen Chất liệu: vải hơi ráp áo mỏng , chất lượng kém",negative,material_comfort,true,color_design,free_text_review,shopee_real_scraped
1591,"Dây áo siêu ngắn, còn k co dãn đc. Mình đã chỉnh hết cỡ rồi nhưng cảm giác 2 đoạn dây siết chặt vào vai, đây mới mặc thử chứ chưa nói mặc cả ngày :((",positive,damaged_defective,false,,free_text_review,shopee_real_scraped
1592,Đúng với mô tả: k đ Màu sắc: ghi Chất liệu: mỏng K ngờ nó mỏng lễ mỏng lét như v luôn á mang như k mang ý chẳng nâng ngực tẹo nào .phí tiền mua,negative,damaged_defective,true,material_comfort,free_text_review,shopee_real_scraped
1593,"shop tư vấn không đúng size, nhắn đổi trả thì không trả lời. Màu ghi nhạt không giống ảnh( không đẹp)",negative,size_fit,true,color_design,free_text_review,shopee_real_scraped
1594,"Chật, mặc bị kích phải mua thêm đoạn nối",positive,no_issue,true,size_fit,free_text_review,shopee_real_scraped
1595,"Đóng gói kém , ẩu",negative,packaging,false,,free_text_review,shopee_real_scraped
1596,Giao thiếu 1 cái áo 🥲,negative,wrong_missing_item,true,shipping_delivery,free_text_review,shopee_real_scraped
1597,Quả to bè chứ không tròn như ảnh,neutral,damaged_defective,false,,free_text_review,shopee_real_scraped
1598,"Ảnh và video nhận su giao đủ hàng giao nhanh giá mềm. Áo form nhỏ xíu, mặc chật ních. Mấy mẫu kia cùng size thì vừa",positive,no_issue,true,shipping_delivery,free_text_review,shopee_real_scraped
1599,"Chất liệu: oki Shop giao nhầm sixe ko cho hoàn trả hơi thất vọng vì mua khá nhiều đồ. Shop thảo mộc hoa chuyên sỉ lẻ giày múa đen trắng, bata buộc dây",negative,material_comfort,true,shipping_delivery,free_text_review,shopee_real_scraped
1600,"Áo chật bé , kp bé bầu ngực mà bé ngắn dây cài , k cài được . Không ưng cho lăm",positive,no_issue,false,,free_text_review,shopee_real_scraped
1601,Giao nhầm sản phẩm,neutral,product_quality,false,,free_text_review,shopee_real_scraped
1602,Không giốnh ảnh,neutral,no_issue,false,,free_text_review,shopee_real_scraped
1603,Cái thì thiếu cái thì dư,neutral,no_issue,false,,free_text_review,shopee_real_scraped
1604,quá mỏng,negative,material_comfort,false,,free_text_review,shopee_real_scraped
1605,Giặt thì bị xù,neutral,no_issue,false,,free_text_review,shopee_real_scraped
1606,Màu sắc: đúng,neutral,color_design,false,,free_text_review,shopee_real_scraped
1607,Chất tạm dc,neutral,no_issue,false,,free_text_review,shopee_real_scraped
1608,Giao nhầm,neutral,spam_irrelevant,false,,spam_irrelevant,shopee_real_scraped
1609,Tạm đc ạ,neutral,no_issue,false,,free_text_review,shopee_real_scraped
1610,Sản phẩm: Sản phẩm không như mô tả,negative,damaged_defective,false,,free_text_review,shopee_real_scraped
1611,Sản phẩm: Sản phẩm chất lượng kém,negative,product_quality,false,,free_text_review,shopee_real_scraped
1612,"Nút vỏ dễ bị bung ra hơi lỏng lẻo, miệng bị đẽo 1 lỗ to sản phẩm lỗi. Giao hành khá lâu ( do covid) shiper thân thiện",negative,damaged_defective,true,shipping_delivery,free_text_review,shopee_real_scraped
1613,"Chất lượng sản phẩm: nhựa Đúng với mô tả: lấy hàng ko chọn lọc kỹ, bị xước, mòn như hàng đã sử dụng Hơi thất vọng một chút, hi vọng đơn hàng sau sẽ caia thiện hơn... dù giá trị ko cao lắm",negative,damaged_defective,false,,free_text_review,shopee_real_scraped
1614,Hàng giao lại cái nào cũng bị móp,negative,packaging,false,,free_text_review,shopee_real_scraped
1615,Sản phẩm đúng nhưng bên vận chuyển thái độ vs mình làm lạc đơn của mình xog điện báo cáo nhưng lúc đó mình bận ko nghe máy dc . Lúc về mình thấy số lạ điện nên đã điện lại 2 lần ko ai nghe máy . Tí nữa 30p sau bên vận chuyện điện lại mắng mình bảo đơn hàng bị lộn có tí mà điện quài ? Rõ ràng trc đó mình có bt j đâu nếu shop giúp mình phản ánh vận chuyển mình sẽ đánh giá 5sao 🥰 1 h*****0,positive,shipping_delivery,true,damaged_defective,free_text_review,shopee_real_scraped
1616,Ship đến đa phần bị móp gói ko kỹ quá tệ ko đáng để mua có thì đi shop khác nha mn 1 thunhuy809,negative,packaging,false,,free_text_review,shopee_real_scraped
1617,"Sản phẩm: Hàng lỗi hoặc bị hư hỏng Loại 7kg Nhưng Đổ Hết Sức,Làm Mọi Cách Cũng chỉ được từ 6kg - 6,5kg...Đã Đổi Sang Cân Khác Cũng Vậy...Liên Hệ Shop Thì K Phản Hồi...Nghi Ngờ Bị Lỗi Khuôn Nhưng Liên Hệ K Phản Hồi...Quá Bức Xúc",negative,damaged_defective,true,seller_service,free_text_review,shopee_real_scraped
1618,T tưởng nó làm dùm luôn về phải trét hồ mới xài đc,neutral,no_issue,false,,free_text_review,shopee_real_scraped
1619,Đúng với mô tả: đúng Nắp đậy không vừa dễ rớt phải dán băng keo nhưng chưa biết có giữ được không?,positive,damaged_defective,false,,free_text_review,shopee_real_scraped
1620,"Yeah thấy mn mua khen đc nên mình cũng mua theo, thất vọng thật sự ý",negative,no_issue,false,,free_text_review,shopee_real_scraped
1621,Hang dung mo ta nen mua,neutral,no_issue,false,,free_text_review,shopee_real_scraped
1622,"Chất lượng sản phẩm: bị trầy xước , ko đẹp nhưng tạm chấp nhận",positive,damaged_defective,false,,free_text_review,shopee_real_scraped
1623,"Không ăn thua lắm, tay cầm bé quá nên đổ xi măng vào cầm bị cong cả tạ",neutral,no_issue,false,,free_text_review,shopee_real_scraped
1624,Vỏ chứ ko có nặng,neutral,no_issue,false,,free_text_review,shopee_real_scraped
1625,"Chất lượng sản phẩm: ko ổn lắm Đúng với mô tả: đúng Nắp đậy lỏng la long lét rớt hoài, shipper thận thiện nhen, nch hàng tạm còn shipper 10đ",positive,no_issue,false,,free_text_review,shopee_real_scraped
1626,Sản phẩm tốt nhưng chỗ cầm hơi nhũn kiểu j í đf đẫ đổ betong vào r,positive,damaged_defective,false,,free_text_review,shopee_real_scraped
1627,Khont dung voi mota nhe khong cho cat thi lam tap fuoc ha ban oi,neutral,no_issue,false,,free_text_review,shopee_real_scraped
1628,Đúng với mô tả: đúng Chất lượng sản phẩm: bình thường 4 cái thì vỡ mất 1 cái,negative,damaged_defective,false,,free_text_review,shopee_real_scraped
1629,mất tiền mua mà nhận hàng như 🆑 lúc mở hàng tạ méo 1 bên xong còn bị nứt nữa,neutral,damaged_defective,false,,free_text_review,shopee_real_scraped
1630,"Hàng bị méo, tên hàng và hình ảnh dể bị nhầm lẫn g",neutral,no_issue,false,,free_text_review,shopee_real_scraped
1631,ta gì mà ko có nắp,neutral,no_issue,false,,free_text_review,shopee_real_scraped
1632,Nắp đậy thì lỏng k giữ đc . Còn tạ gì mà k có cái gì nhẹ như bấc vậy shop,positive,no_issue,true,damaged_defective,free_text_review,shopee_real_scraped
1633,Lỗ to đùng cái nặp bị lọt xuống lỏng lẻo,negative,no_issue,false,,free_text_review,shopee_real_scraped
1634,Đúng với mô tả: sản phẩm càn phải chú trọng hon nút quá dễ rớt ra:((((((((((((,positive,no_issue,false,,free_text_review,shopee_real_scraped
1635,Đúng với mô tả: ko Chất lượng sản phẩm: tệ Mang tiếng là top 3 shop bán tạ bán chạy nhất shopee mà shop giao thiếu nắp đậy Xong ship hàng bố láo làm móp tạ dẫn đến bị thủng lỗ Đặt tạ 4kg mà đo cân có mỗi 2kg? (Hình ảnh mang tính chất lấy xu vì máy bị đơ cam ko chụp đc sp),negative,packaging,true,shipping_delivery,free_text_review,shopee_real_scraped
1636,Hàng bảo quản o cẩn thận đến đã bị móp 1 đầu 😭,negative,packaging,false,,free_text_review,shopee_real_scraped
1637,"Vải nồi tưởng là cục tạ, ai ngờ đâu chỉ là cái vỏ, h bt bỏ gì vào để đc 2kg đây? Nắp tạ thì lỏng",neutral,no_issue,false,,free_text_review,shopee_real_scraped
1638,"đen tiếng Việt thì cụm từ sẽ gầy chính là việc dự báo về một trạng thái cơ thể trong thời gian tới. Từ sẽ là từ ý chỉ tương lai và từ gầy là trạng thái cơ thể đối lập so với mập. Khi đó, sẽ gầy sẽ được hiểu là một ai đó đang nỗ lực để khiến bản thân nhẹ cân đi. https://meta.vn › hotro › se-gay-la-g",positive,no_issue,false,,free_text_review,shopee_real_scraped
1639,"Vỏ nhựa có nắp nhưng nắp ko chặt, nập vào là rơi",positive,damaged_defective,false,,free_text_review,shopee_real_scraped
1640,Chất lượng sản phẩm: do vận chuyển hay sao mà tạ của t em bị móp với bị bể ạ,negative,shipping_delivery,false,,free_text_review,shopee_real_scraped
1641,Sản phẩm bj móp méo trầy xước đóng goid hàng không kỉ,negative,packaging,false,,free_text_review,shopee_real_scraped
1642,chán . mua nhầm vỏ :(,neutral,no_issue,false,,free_text_review,shopee_real_scraped
1643,Về bỏ cát nào nó bị nứt ra,neutral,no_issue,false,,free_text_review,shopee_real_scraped
1644,8kg mà khi cân chỉ đc 5kg,neutral,no_issue,false,,free_text_review,shopee_real_scraped
1645,Sản phẩm: Hàng lỗi hoặc bị hư hỏng Gói hàng ko cẩn thận bị bẹp và thủng luôn,negative,packaging,false,,free_text_review,shopee_real_scraped
1646,Hàng đến bị ọp ép méo xẹo,neutral,no_issue,false,,free_text_review,shopee_real_scraped
1647,vỏ hơi mỏng dễ vỡ,negative,damaged_defective,false,,free_text_review,shopee_real_scraped
1648,hàng trong lúc ship bị móp bị méo,negative,packaging,false,,free_text_review,shopee_real_scraped
1649,Cân nặng k đúng như mô tả,neutral,damaged_defective,false,,free_text_review,shopee_real_scraped
1650,Hàng bị méo mó khá nhiều,neutral,no_issue,false,,free_text_review,shopee_real_scraped
1651,"Thất vọng khi mua sản phẩm này quá, lần sau ko mua nữa, phí cả tiền. Bsjdndorjrrbrn",negative,price_value,false,,free_text_review,shopee_real_scraped
1652,Bên vận chuyển hay do bên giao hàng đã làm móp xước mất fom,negative,shipping_delivery,false,,free_text_review,shopee_real_scraped
1653,"Sản phẩm bị móp, nhồi xong chưa đúng cân",negative,packaging,false,,free_text_review,shopee_real_scraped
1654,"hàng giao đúng thời hạn, tuy nhiên cục tạ nó bị móp lại, chắc do quá trình vận chuyển có vấn đề",negative,shipping_delivery,false,,free_text_review,shopee_real_scraped
1655,Sản phẩm: Hàng lỗi hoặc bị hư hỏng,negative,damaged_defective,false,,free_text_review,shopee_real_scraped
1656,Sản phẩm: Sản phẩm không như mô tả Nhẻ,negative,damaged_defective,false,,free_text_review,shopee_real_scraped
