review_id,review_text,sentiment_label,issue_label,is_multi_topic,secondary_issue,comment_type,source
691,"đặt 2 cái gối nhỏ shop giao có 1 cái , nhắn tin shop hoàn tiền lại gối thiếu",negative,wrong_missing_item,true,size_fit,free_text_review,real_review
692,ok video hình ảnh mang tính chất nhân xu hướng ok rẻ nhất rồi đấy nên mua một cái mà xào gia đình anh có biết,neutral,spam_irrelevant,true,price_value,spam_irrelevant,real_review
693,"sản phẩm nói chung cũng tạm,chất liệu bông bên trong nên sẽ hơi nóng",neutral,material_comfort,false,,free_text_review,real_review
694,gối massage rất đẹp,positive,color_design,false,,shopee_template_review,real_review
695,gối đẹp đáng mua nha mọi người gối rất êm nhưng bé gối thì sẽ cao,positive,material_comfort,true,material_comfort,free_text_review,real_review
696,"shop đóng gói kỉ , gối đẹp, ưng bụng lắm. sẽ ủng hộ shop nữa. cho shop",positive,packaging,true,color_design,free_text_review,real_review
697,ngồi ok lắm mọ. ngời mua thở gì nhé,positive,no_issue,false,,free_text_review,real_review
698,gối êm mềm.giống quảng cáo sẽ ủng hộ khi có nhu cầu tiếp,positive,material_comfort,false,,free_text_review,real_review
699,"sử dụng khá ổn giao hàng nhanh, đóng gói cẩn thận",positive,packaging,true,shipping_delivery,shopee_template_review,real_review
700,gối đẹp. giá rẻ mà hàng chất lượng bất ngờ luôn. 5sao cho shop,positive,product_quality,true,color_design,free_text_review,real_review
701,bông mềm nằm lõm gối nếu kê 2 caia thì cao 1 thì thấp quá,positive,material_comfort,true,size_fit,free_text_review,real_review
702,sản phẩm dùng tốt rất ok mềm mại em ái ....đóng gói rất cẩn thận,positive,packaging,true,product_quality,free_text_review,real_review
703,"nhìn có vẻ ok hy vọng dùng tốt dễ chịu, thoải mái nhất có thể. cảm ơn shop",positive,product_quality,true,material_comfort,free_text_review,real_review
704,gối saap mình nhân được hàng rồi gối rất ok nha mọi người nên mua nha cho shop 5 sao,positive,no_issue,false,,shopee_template_review,real_review
705,"tb nạp thẻ đủ đầy - data xài ngay! tặng 20% giá trị tất cả thẻ nạp vào tài khoản viễn thông trong ngày 25 09 2025. tiền km sử dụng truy cập internet trong 15 ngày. nạp thẻ online tại các ví điện tử, ứng dụng",neutral,spam_irrelevant,false,,spam_irrelevant,real_review
706,sản phẩm giống như mô tả gối mềm êm dễ chịu giao hàng nhanh cho shop 5 sao,positive,material_comfort,true,shipping_delivery,free_text_review,real_review
707,nằm chả thấy đỡ đau vai gáy gì cả vẫn đau như thường,negative,damaged_defective,true,material_comfort,free_text_review,real_review
708,gối êm không biet gối y như mô tả. mà lún ở giữa có lẽ k thích bằng không lún,negative,damaged_defective,true,material_comfort,shopee_template_review,real_review
709,"đfg trgy gọi em là hoàng hôn vì phải chiều mới có được em. một bước đi sai ngàn lối tắc, đạp đổ nguyên tắc vạn lối đi. mây kia là của trời xanh tim anh đã có ai vào hay chưa? chỉ tay lên trời hận đời vô đối, gục mặt xuống gối đi ngủ cho rồi",neutral,spam_irrelevant,false,,spam_irrelevant,real_review
710,êm ái dễ chịu vải bông 100k 1 đôi gối nằm thoải mái dễ ngủ lên mua nha mọi ng,positive,material_comfort,false,,shopee_template_review,real_review
711,không biết phải nói sau mềm thì cũng mềm mà nằm phải 2 cái mới vừa nó lún xuống lắm,positive,material_comfort,true,size_fit,free_text_review,real_review
712,"hàng ok, giao hàng nhanh, đúng mẫu mã. dùng ok, nằm lệch vai không mỏi cổ",positive,shipping_delivery,true,material_comfort,free_text_review,real_review
713,"tốt gối êm nằm thoả mái, nhanh ik vào giấc ngủ lắm luôn, đáng để thử nha",positive,product_quality,true,material_comfort,shopee_template_review,real_review
714,"cũng ổn giá cũng rẻ, video dài quá không cho vô được. gối rất êm",positive,material_comfort,true,price_value,shopee_template_review,real_review
715,mình nhạn được hàng và mình cảm thấy ngủ ngon hơn vì nó chỉnh được cổ ạ nằm k bị đau,positive,material_comfort,false,,free_text_review,real_review
716,"sản phẩm đúng với mô tả, nằm êm ái, nói chung là ok ạ, xứng đáng vs giá tiền",positive,material_comfort,true,price_value,free_text_review,real_review
717,"đã nhận được hai gối như đơn đặt,mình tặng 1 cái cho bố,1 cái cho mẹ.rất ưng ý",positive,material_comfort,false,,free_text_review,real_review
718,"gối chất lượng cực kì, ngủ siêu thoải mái, dễ chịu, thích lắm ae",positive,product_quality,true,material_comfort,free_text_review,real_review
719,"nằm êm và dễ chịu , đỡ đau cổ nữa",positive,material_comfort,false,,free_text_review,real_review
720,gối êm dễ gối. chất liệu mềm mại tuy nhiên gối to quá để chiếm hết diện tích của dường,positive,material_comfort,true,size_fit,shopee_template_review,real_review
721,ok giao đúng mẫu gói hơi mềm nằm cũng thấy thoải mái nhe thấy ok lắm,positive,material_comfort,false,,shopee_template_review,real_review
722,như ảnh gối đẹp mềm mại giống mẫu mình lười quay video nên chỉ để lại nx vậy,positive,material_comfort,true,material_comfort,shopee_template_review,real_review
723,sản phẩm rất phù hợp với người khoa ngủ như tui,positive,material_comfort,false,,shopee_template_review,real_review
724,"sản phẩm tốt, xinh lắm á , shop nhiệt tình , ship thân thiện , mê nha",positive,shipping_delivery,true,product_quality,free_text_review,real_review
725,goi chống mỏi vai gáy khá êm chat lieu mem chưa nằm lâu khônnh biết có ok không,positive,material_comfort,true,material_comfort,shopee_template_review,real_review
726,"gối mềm ,êm , bự ,nằm thoải mái gối đầu . giá tốt không mắc cũng không rẻ",positive,product_quality,true,material_comfort,shopee_template_review,real_review
727,ok hình ảnh mang tính chất nhận su gối nhìn rất xịn sò và thích mình mua tặng bạn mình ưng lắm cảm ơn shop,positive,no_issue,false,,shopee_template_review,real_review
728,"ổn nằm êm thích thoải mái cho cổ lắm, ae gymmer ngủ rất oke la nhé",positive,material_comfort,false,,shopee_template_review,real_review
729,giao hàng nhân đung nhu quang cáo,positive,shipping_delivery,false,,free_text_review,real_review
730,"khá ổn so với tầm giá, nằm êm không bị đau cổ",positive,material_comfort,true,price_value,free_text_review,real_review
731,"rat em ai nam len không bị đau cổ chaats lieu mềm mại ,thoáng mát he",positive,material_comfort,false,,shopee_template_review,real_review
732,chất lượng nằm êm thoải mái,positive,product_quality,true,material_comfort,free_text_review,real_review
733,giao hàng nhanh. mua 2 sản phẩm là gối và móc treo. goos mềm mại ngủ ngon. giá hợp lý. shop quên giao móc treo,positive,shipping_delivery,true,material_comfort,shopee_template_review,real_review
734,"hàng đẹp ,chất lượng tôt",positive,product_quality,true,color_design,free_text_review,real_review
735,"gối nằm thoải mái, dễ chịu 10 điểm. shop giao hàng nhanh, đóng gói cẩn thận",positive,packaging,true,shipping_delivery,free_text_review,real_review
736,shop giao hàng nhanh hàng đúng màu đúng mẫu gối hơi cao phần bông bên trong không có lớp lót nếu muốn vệ sinh gối thì cũng hơi bất tiện nhưng với giá này không đòi hỏi gì thêm cảm ơn shop,neutral,damaged_defective,true,shipping_delivery,free_text_review,real_review
737,tốt hàng ok. giá rẻ. vỏ hơi không được như hình cho lắm. mỏng bí hơn,neutral,damaged_defective,true,product_quality,shopee_template_review,real_review
738,cửa hàng hàng giao đúng mẫu mã màu sắc chất lượng sản phẩm ổn nằm vừa phải thoải mái,positive,product_quality,true,material_comfort,free_text_review,real_review
739,"rất thích, gối mềm mại ngủ ngon giấc, ok",positive,material_comfort,false,,free_text_review,real_review
740,vừa khớp đầu dễ vào giấc,positive,size_fit,false,,free_text_review,real_review
741,"rất hài lòng giao hang nhanh ,ship nhiệt tình,gối rat thoải mái ,se ung hộ shop",positive,shipping_delivery,true,material_comfort,shopee_template_review,real_review
742,chất lượng của sản phẩm tuyệt vời giao hàng nhanh chóng nên mua nha mọi người,positive,shipping_delivery,true,product_quality,free_text_review,real_review
743,"giao hàng đúng tgian đóng gói hàng cẩn thận , đánh giá tốt nha hi",positive,packaging,true,shipping_delivery,free_text_review,real_review
744,"gối nằm êm nằm là ngủ liền đẹp tuyệt trần bay phấp phới, không uổng công đợi mấy tháng trời để shop về màu yêu thích loveeee",positive,material_comfort,true,color_design,free_text_review,real_review
745,ok vải nhận xu để nằm 1thời gian coi xẹp hok sẽ giới thiệu bb sài,positive,material_comfort,false,,shopee_template_review,real_review
746,nằm siu thích luôn,positive,material_comfort,false,,free_text_review,real_review
747,sản phẩm dùng rất tốt.gối êm phù hợp với giá tiền.đã mua lần hài,positive,product_quality,true,material_comfort,free_text_review,real_review
748,gối đẹp êm nhưng mình lắm gối cao thì hơi xẹp nha hợp với ai thích nằm gối thấp thôi ạ,neutral,damaged_defective,true,material_comfort,free_text_review,real_review
749,gối ôm đầu thoải mái,positive,material_comfort,false,,shopee_template_review,real_review
750,hàng y hình đúng lâu xem. có ok. không nha,positive,no_issue,false,,free_text_review,real_review
751,"gối êm, đẹp, nằm rất thoải mái",positive,material_comfort,true,color_design,free_text_review,real_review
752,giao hàng nhanh lắm nha đóng gói cẩn thận lắm nè giao hàng đầy đủ lắm ạ,positive,packaging,true,shipping_delivery,free_text_review,real_review
753,"gối rất êm, nằm thoải mái dễ ngủ hơn chất liệu mền mại màu sắc shop giao đúng",positive,material_comfort,true,color_design,shopee_template_review,real_review
754,"sản phẩm chất lượng tốt, giao hàng nhanh chóng. sẽ ủng hộ tiếp cho shop",positive,shipping_delivery,true,product_quality,free_text_review,real_review
755,sản phẩm tốt dùng luôn rồi hihi,positive,product_quality,false,,free_text_review,real_review
756,tuyệt vời . mua 1 cái quay lại mua thêm 4 cái và giờ lại đặt thêm 1 cái nữa,positive,material_comfort,false,,shopee_template_review,real_review
757,"cuộc sống vẫn thế thôi, chỉ là mình chọn nhìn nó bằng tâm trạng dễ thương hơn",neutral,spam_irrelevant,false,,spam_irrelevant,real_review
758,sản phẩm nằm rất mềm và êm rất ok,positive,material_comfort,false,,free_text_review,real_review
759,mềm êm ái,positive,material_comfort,false,,shopee_template_review,real_review
760,sản phẩm tốt như giới thiệu. hàng giao nhanh và đẹp. sẽ ủng hộ shop vào lần sau,positive,product_quality,true,product_quality,free_text_review,real_review
761,"mực in trên mấy cái phím đen không ổn, cứ có cảm giác cào cái ra bong mất ấy, nhưng nhìn chung thì hợp lý với tầm tiền, gõ ra chữ là được. chỉ có cái là shop lấy hàng có 2 cái lỗ sâu xước cả sản phẩm ở trong để giao cho khách, 2 cái vệt này không phải do ship vì lớp nilon chống sốc bọc bên ngoài lúc giao đến không bị sao cả",negative,damaged_defective,true,packaging,free_text_review,real_review
762,"tiền nào của nấy. ai làm văn phòng thì khuyên không nên mua thì thiếu vài nút để làm tác vụ nhanh như home, end nói chung trang trí thì ok",negative,damaged_defective,true,price_value,free_text_review,real_review
763,"9 10 êm, đẹp, gọn nhẹ và sử dụng được nhưng tiếng lạch cạch còn to hơn tiếng gõ bàn phím và đèn bàn phím không sáng",negative,damaged_defective,true,material_comfort,shopee_template_review,real_review
764,như hình dùng cơ bản. giả cơ nên cũng không đòi hỏi nhiều. dùng tạm được không rõ độ bền,negative,damaged_defective,true,product_quality,shopee_template_review,real_review
765,dùng cũng ol có thể là do người đăng ký facebook ngay hôm nay sẽ,neutral,spam_irrelevant,false,,spam_irrelevant,real_review
766,san phẩm tốt và đẹp,positive,product_quality,true,color_design,shopee_template_review,real_review
767,"giao hàng nhanh, một số phím không nhạy ví dụ chơi game bấm nhưng nó không hoạt động nút đó",negative,damaged_defective,true,shipping_delivery,free_text_review,real_review
768,"tốt volume nob cảm giác hơi rẻ tiền nhưng thôi, ít nhất là có tính năng như volume nob và độ nhạy tốt",negative,damaged_defective,true,product_quality,shopee_template_review,real_review
769,okay sản phẩm ngôn haii 10 điểm giống mô ta ngọnnnnnnnnnnnnnnnnnnnnnnnn,positive,no_issue,false,,free_text_review,real_review
770,có đèn led dùng được trong phân khúc 200 shop cần lưu í làm nổi chữ bằng led tối sẽ hơi khó nhìn và dấu cách bị lỏng có tiếng hơi khó chịu nha,neutral,color_design,false,,shopee_template_review,real_review
771,tốt led sáng đẹp,positive,product_quality,true,color_design,shopee_template_review,real_review
772,chắt lượng ok,positive,no_issue,false,,shopee_template_review,real_review
773,"dùng rất ok, phím bấm mượt mà",positive,no_issue,false,,free_text_review,real_review
774,tốt có led giao lâu hơn dự tính,negative,shipping_delivery,true,product_quality,shopee_template_review,real_review
775,"sản phẩm đẹp, giao nhanh",positive,color_design,false,,free_text_review,real_review
776,"phím bấm k sướng lắm so với bàn phím giả cơ khác, đèn thì ok, k xuất sắc k dở",negative,color_design,false,,free_text_review,real_review
777,mmmmmmmmmmmmmmmmm trừ phím space thì mọi thứ đều ở mức ổn trong tầm giá 200,positive,price_value,false,,shopee_template_review,real_review
778,tốt nhưng tiếng không đã lắm đủ 7 màu nha ae nên mua nếu không đủ tiền mua cái quá đắt,negative,damaged_defective,true,product_quality,shopee_template_review,real_review
779,"giao hàng hơi chậm chút, chưa cắm vào dùng nên chưa biết",negative,damaged_defective,true,shipping_delivery,free_text_review,real_review
780,loại này nếu không dây thì ok hơn,positive,no_issue,false,,free_text_review,real_review
781,đèn có 2 chế độ,neutral,color_design,false,,shopee_template_review,real_review
782,"bàn phím đẹp sài ổn, mà lúc giao hơi cấn phím nha chỉnh lại xíu là được",positive,color_design,false,,free_text_review,real_review
783,"giao hàng nhanh, đúng sản phẩm",neutral,shipping_delivery,false,,free_text_review,real_review
784,bàn phím thì ổn. chuột thì hỏng sau hơn 1 tháng sử dụng,negative,damaged_defective,false,,free_text_review,real_review
785,phím caps khi bật đèn không sáng khả năng là hỏng đèn còn lại thì ok,negative,damaged_defective,true,color_design,free_text_review,real_review
786,tuy có rbg đẹp nhưng mà gõ nó kiểu không phê chp lắm,negative,damaged_defective,true,color_design,free_text_review,real_review
787,"chất lượng ok, cảm giác gõ không quá ấn tượng nhưng phù hợp với giá tiền. sa",negative,damaged_defective,true,product_quality,free_text_review,real_review
788,mình thấy ok nhé . tiền nào của đó gĩ k tanh tắch như mấy bàn cũ của mình,negative,damaged_defective,false,,free_text_review,real_review
789,"đặt về quê nên không biết sản phẩm có ok không, nhưng mà thấy mọi người review bảo ok thì chắc sản phẩm ok luôn, mặc dù",negative,damaged_defective,false,,free_text_review,real_review
790,good bàn phím không sáng,negative,color_design,false,,shopee_template_review,real_review
791,được cái đẹp thôi chứ thiết kế hơi nhỏ đánh game văn bản thì hơi nhỏ so với tay,positive,product_quality,true,color_design,free_text_review,real_review
792,hinh anh va video chi mang tinh chat nhan xu,neutral,no_issue,false,,free_text_review,real_review
793,mới dùng 1 thời gian mà mờ chữ trên bàn phím rồi,negative,product_quality,false,,free_text_review,real_review
794,"bình thường, chấp nhận trong tầm giá không thấy bàn phím mới mở hàng sẽ đầy mùi nhựa. cần để 2 - 3 ngày mới hết. nhiều phím gia công lởm khởm chắc do lỗi trong quá trình đổ nhựa cảm giác phím và âm không quá đã, nhưng giá rẻ nên tạm chấp nhận",negative,damaged_defective,true,price_value,shopee_template_review,real_review
795,hàng nhăn nha nhưng mà phím đẹp,negative,damaged_defective,true,color_design,free_text_review,real_review
796,giao sai màu còn lại thì ok,negative,wrong_missing_item,true,color_design,free_text_review,real_review
797,cảm giác bấm k chắc tay lắm ạ,negative,product_quality,false,,free_text_review,real_review
798,quá nhanh xử phạt nữ sinh vừa đi xe máy vừa sử dụng điện thoại xem tóp tóp sau khi bị người dân phản ánh,neutral,spam_irrelevant,false,,spam_irrelevant,real_review
799,"hộp bị móp, phím bị rớt ra trong quá trình vận chuyển, may là bàn phím sủ dụng bình thường",negative,damaged_defective,true,packaging,free_text_review,real_review
800,đèn led tốt thêm 41 ký tự và 1 hình ảnh và 1 video để nhận 200 xu. màu khá bàn phím khá đẹp nghe tiếng khá ổn nhưng không lắp được switch nên chỉ cho 4 sao thôi nhưng đổi lại gõ khá mượt đèn led đẹp xl mọi người chỉ có vid không có ảnh,positive,color_design,true,product_quality,shopee_template_review,real_review
801,"tốt phím chắc , số nét, màu sắc đẹp bắt mắt. chuột hơi nhẹ. bấm nảy. khá nhạy vận chuyển thì chán. cảm giác như mang gói hàng mài 1 đoạn đường hay sao mà mòn vạ hết 1 góc chuột",negative,damaged_defective,true,packaging,shopee_template_review,real_review
802,tạm được,neutral,spam_irrelevant,false,,spam_irrelevant,real_review
803,cũng ok phết,positive,no_issue,false,,free_text_review,real_review
804,ngon nha nhưng không như tưởng tượng,neutral,damaged_defective,false,,free_text_review,real_review
805,nó bị liệt nút,negative,damaged_defective,false,,free_text_review,real_review
806,"shop ship hàng nhanh tư vấn nhiệt tình,mua có voucher nên giá quá rẻ luôn,sẽ ủng hộ shop lâu dài",positive,shipping_delivery,true,price_value,free_text_review,real_review
807,"everyone rửa tay, loại bỏ vi khuẩn quá ok rùi, đã cân thử đúng 1kg, ban đầu mình chiết ra chai chất đặc lắm, qua lần sau thì lỏng như pha nước vào vậy. mình dùng 1 thời gian mới ql đánh giá, shop không nên pha lỏng như vậy làm ăn gian dối quá",negative,damaged_defective,true,seller_service,shopee_template_review,real_review
808,"quảng cáo kèm khuyến mại mà thủ tục phức tạp như đánh lừa người mua, lần trước tôi cg mua nhưng sản phẩm km hiện lên theo đơn rất rõ ràng để chọn, lần này mình tìm không thấy mục chọn quà km tưởng cứ đơn trên 199k là được. shop làm vậy như lừa đảo khách hàng!",negative,damaged_defective,true,seller_service,free_text_review,real_review
809,shop đóng hàng rất sơ xài k bọc chống sốc túi nước rửa tay bị chọc bục đổ hết đồ sang đồ bên cạnh. chưa bao giờ đánh giá kém nhưng hôm nay rất thất vọng,negative,damaged_defective,true,packaging,free_text_review,real_review
810,"đóng gói cẩu thả, nhôm nhem, sản phẩm dù có tốt thì cách đóng gói như vậy là xem thường khách hàng",negative,damaged_defective,true,packaging,free_text_review,real_review
811,ghi là có tặng quà mà không có quà. giá cũng không rẻ so với bến ngoài. mấy đồ này mua ngoài quán tiện hơn. được cái giao hàng nhanh thậy,negative,wrong_missing_item,true,shipping_delivery,free_text_review,real_review
812,"trải nghiệm lần đầu nhưng quá tệ vì đóng hàng không có tí trách nhiệm nào, không bọc miệng sản phẩm, hay bao gói cẩn thận, 1 chai sản phẩm tặng chảy be bét, còn nửa lọ, xin cảm ơn sự phục vụ này, không có lần thứ 2",negative,damaged_defective,true,product_quality,shopee_template_review,real_review
813,"gói hàng sơ sài, như kiểu bị bóc hàng nước rửa tay đủ nhưng không thấy có quà",negative,wrong_missing_item,true,damaged_defective,free_text_review,real_review
814,"đóng gói quá tệ, chảy hết cả ra hộp ướt hết các sản phẩm, phải rửa mãi mới sạch",negative,damaged_defective,true,packaging,free_text_review,real_review
815,giao hàng nhanh. sản phẩm thi oke nhưng đóng gói rất ẩu. lọ sữa tắm bị rỉ ra,negative,damaged_defective,true,packaging,free_text_review,real_review
816,"sạch da mọi người chuẩn bị hàng lâu, date 2026, mình chưa kịp bấm nhận deal sốc muốn đặt lại đơn nhưng shop không hỗ trợ",negative,damaged_defective,true,seller_service,shopee_template_review,real_review
817,"mọi người diệt khuẩn lần này nhận được hàng của shopee mail mà thất vọng quá đóng gói chẳng cận thận gì cả, hộp thì rách méo lung tung không biết bên trong hàng có đúng của shop nữa k đây hay bị tráo đổi",negative,damaged_defective,true,packaging,shopee_template_review,real_review
818,"gioa hàng rất nhanh nhưng lần nào gói hàng cũng vậy. không có chống sốc, không có chèn gì, rất sợ hàng bị bể",negative,damaged_defective,true,packaging,free_text_review,real_review
819,hoa hoc tốt giá đắt mặc dù đã khuyến mãi. khuyên các bạn ra aeon mà mua giá có 105k thôi mà k mất công chờ đợi j,negative,product_quality,true,price_value,shopee_template_review,real_review
820,"sản phẩm chất lượng kém, sản phẩm không như mô tả, sản phẩm giả mạo, hàng lỗi hoặc bị hư hỏng gi and her family have a great relationship with her family so",negative,product_quality,false,,free_text_review,real_review
821,"hàng giao nhanh, bao bì nước rửa tay và sữa tắm giống nhau quá nên đặt hàng hay bị nhầm",positive,packaging,false,,free_text_review,real_review
822,"mui không thom sach rửa tay mau xanh ngửi mùi hơi hôi chứ không thơm như mấy lần trước mjh mua. mùi thúi s đâu á, kì lắm mà lỡ khui ra nên không trả lại",negative,damaged_defective,true,product_quality,shopee_template_review,real_review
823,dong goi k cẩn thận. sơ sai k chong soc . vo ngoai hoi nhờn hhxbsn,negative,packaging,false,,free_text_review,real_review
824,chụp ảnh quảng cáo thì chụp 2 túi làm người mua nhầm lẫn là được 2 túi. ai dè là 1 túi. chiêu trò này hay đấy nhưng không nên làm vậy. làm nhiều mất khách. thằng nào làm marketing như này - có cái nết chộp giật. mua tưởng rẻ hoá mua đúng giá,negative,damaged_defective,true,packaging,free_text_review,real_review
825,"shop đóng hàng cẩu thả, giao gom đơn vào 1 đơn mà đóng gói sơ sài, hàng giao đến thùng thì méo mó, hàng thì bị xì chảy tùm lum",negative,damaged_defective,true,packaging,free_text_review,real_review
826,hình quảng cáo là 2 túi + có quà tặng là tdc cơ nhưng thực tế có mỗi 1 túi này hụt hẫng đúng là quảng cáo lừa,negative,wrong_missing_item,true,damaged_defective,free_text_review,real_review
827,lần nào mua hàng của uni cũng bị thiếu hàng khuyến mãi. lần mua sàn lzd cũng thiếu rồi đổ lỗi do khâu đóng sót. cũng không có phương án giải quyết. lần này mua bên shopee cũng không có hàng khuyến mãi. không lẽ lần nào cũng là do khâu đóng gói,negative,wrong_missing_item,true,damaged_defective,free_text_review,real_review
828,"mình săn ngày 1 1 mua để được tặng quà, háo hức khui hàng thì lại không có quà tặng. shopeemall mà làm ăn gian dối",negative,wrong_missing_item,true,seller_service,free_text_review,real_review
829,"bọc hàng kém, bung lộ hết bên trong, không thấy hàng tặng kèm không rõ là do shop không cho vào hay là rơi mất trong khi vận chuyển",negative,damaged_defective,true,packaging,free_text_review,real_review
