review_id,review_text,sentiment_label,issue_label,is_multi_topic,secondary_issue,comment_type,source
2254,"Bị giật rất đau, miếng dán sài được một lần",neutral,no_issue,false,,free_text_review,shopee_real_scraped
2255,Công dụng: k awn thua Giống mẫu nhưng mng k nên mua nha mát xa k thấy giật điện đau điếng đúng của rẻ thì k gì tốt haiz,positive,damaged_defective,true,color_design,free_text_review,shopee_real_scraped
2256,"Chất liệu: mềm, mỏng Đúng với mô tả: đúng như trong hình Màu sắc: màu đen Mua về còn rất nhiều vải thừa còn sót lại",positive,no_issue,true,damaged_defective,free_text_review,shopee_real_scraped
2257,"Chất liệu: vải gì ko ro Màu sắc: màu da Đúng với mô tả: đúng với mô tả,chất cg ok hợp với giá tiền",positive,no_issue,true,material_comfort,free_text_review,shopee_real_scraped
2258,Chất liệu: vải co giãn Màu sắc: đen Đúng với mô tả: tạm Hàng ngaăn mỏng ko đc như ý,positive,no_issue,true,damaged_defective,free_text_review,shopee_real_scraped
2259,Màu sắc: đen Chất liệu: mỏng Đúng với mô tả: hok đúng với mô tả,positive,no_issue,true,material_comfort,free_text_review,shopee_real_scraped
2260,"Tiền nào của đấy, hàng rẻ nên vừa xỏ đã rách r, may mua có 1 đôi ko thì phí tiênf",positive,no_issue,true,damaged_defective,free_text_review,shopee_real_scraped
2261,Đúng với mô tả: ko đúng lắm Chất liệu: vải Màu sắc: đen Sản phẩm hơi mỏng và hơi ngắn ko đc co giản tốt lắm,positive,no_issue,true,material_comfort,free_text_review,shopee_real_scraped
2262,Rất bực về cách shop làm việc. Màu khách đặt ko có thì ko thèm báo mà tự ý giao màu khác... Chất liệu thun mà mỏng quá,negative,material_comfort,true,shipping_delivery,free_text_review,shopee_real_scraped
2263,"Mỏng , ko vừa size với nam giới , khi đeo vào chả khác gì giống tất quần của nữ giới cả",negative,size_fit,true,material_comfort,free_text_review,shopee_real_scraped
2264,Chất liệu: vải mỏng Màu sắc: đẹp Đúng với mô tả: k đúng với mô tả. Mua 2 loại.1 loại đắt 1 loại rẻ mà lại gửi 1 loại rẻ thôi.vải mỏng nữa,positive,no_issue,true,material_comfort,free_text_review,shopee_real_scraped
2265,Màu sắc: màu đẹp Chất liệu: mong Đúng với mô tả: không giống như mo tả,positive,no_issue,true,damaged_defective,free_text_review,shopee_real_scraped
2266,Màu sắc: trắng Sản phẩm bị đứt chỉ giao khá lâu và kbt có chống tia UV dc k,negative,damaged_defective,true,shipping_delivery,free_text_review,shopee_real_scraped
2267,Chất liệu: tốt Đúng với mô tả: hơi ngắn Màu sắc: đẹp Có bảo là có thật thì em không thích thì cứ việc mua lại của thế giới là của mình thì thấy có lẽ sẽ có những cái khác nhau mà thôi kệ,positive,no_issue,true,material_comfort,free_text_review,shopee_real_scraped
2268,4 cái bao tay 4 chiều dài khác nhau,neutral,no_issue,false,,free_text_review,shopee_real_scraped
2269,"Đúng với mô tả: không Chất liệu: rất rất mỏng Màu sắc: như hình Vừa ngắn vừa mỏng, không thể chống nắng được, mang vào tay giống như vớ da. Chán",positive,no_issue,true,damaged_defective,free_text_review,shopee_real_scraped
2270,mua như ko :)) biết của rẻ nma ko ngờ mỏng ghê đến vậy,positive,no_issue,true,damaged_defective,free_text_review,shopee_real_scraped
2271,Chất liệu: vải Màu sắc: màu da Sản phẩm tốt nhg shop giao nhầm cái trên cái dưới,positive,no_issue,true,shipping_delivery,free_text_review,shopee_real_scraped
2272,Màu sắc: ok Chất liệu: 4/10 Tạm đc,neutral,material_comfort,true,color_design,free_text_review,shopee_real_scraped
2273,"Chất liệu: vải,mỏng Tiền nào của nấy",neutral,material_comfort,false,,free_text_review,shopee_real_scraped
2274,"Màu sắc: da ,đen Chất liệu: vải Vải mỏng như tờ giấy , chiều dài ngắnn , bé",neutral,damaged_defective,true,material_comfort,free_text_review,shopee_real_scraped
2275,Chỉ nên mua 1 lần duy nhất . Đùa chứ hàng này mà nhìn thấy tận mắt cho còn đánh cho á chứ đừng nói là mua mất tiền nha,positive,no_issue,false,,free_text_review,shopee_real_scraped
2276,Màu sắc: den Chất liệu: mỏng Đúng hàng nhưng quá mỏng đúng là tiền nào của đó mọi người nên căn nhắc,negative,damaged_defective,true,material_comfort,free_text_review,shopee_real_scraped
2277,Màu sắc: đúng Chất liệu: tốt,positive,no_issue,true,material_comfort,free_text_review,shopee_real_scraped
2278,"Màu sắc: đen Đúng với mô tả: đúng Chất liệu: vãi Hơi ngắn , chỉ tới cẳng tay, mấy bạn tay dài sẽ khó chịu, đeo vào có chút ngứa , giặt thì chắc đỡ ( tại ngứa quá nên đang bỏ qua 1 bên chưa giặt)",negative,damaged_defective,true,material_comfort,free_text_review,shopee_real_scraped
2279,vãi mỏng k dùng k có tác dụng bao nhiu .đeo vào là thấy hết da thì chóng nắng kiểu gì,neutral,material_comfort,false,,free_text_review,shopee_real_scraped
2280,Chất lượng hơi kém mới đeo 1 lần chỉ đã tản ra hết đứt hết chỗ xỏ ngón rồi,negative,damaged_defective,false,,free_text_review,shopee_real_scraped
2281,Đúng với mô tả: sai Màu sắc: trang Chất liệu: vai Vải mỏng như tờ giấy ý. Đeo cái này có mà bắt nắng hơn chứ chống nắng j. Ảo thật đó 10k mà như 1k chịu tjaayh,negative,wrong_missing_item,true,damaged_defective,free_text_review,shopee_real_scraped
2282,"Chất liệu: thun Đúng với mô tả: mỏng Màu sắc: da Sản phẩm mỏng như vớ da, không hài lòngnnnnnbbbn",positive,no_issue,true,damaged_defective,free_text_review,shopee_real_scraped
2283,Đúng với mô tả: đúng Màu sắc: đen Chất liệu: vải Hàng mỏng đeo chưa nổi 1 ngày đã rách r chê nhé =)))),positive,no_issue,true,damaged_defective,free_text_review,shopee_real_scraped
2284,"Hàng mỏng, để 2loại,2 giá khác nhau mà vẫn là 1",neutral,material_comfort,true,price_value,free_text_review,shopee_real_scraped
2285,Tiền nào của đấy mỏng hơn lá lúa cơ mà 15k dầy co giản đẹp nnnnnn 😘,positive,no_issue,false,,free_text_review,shopee_real_scraped
2286,Tốt và hơi mỏng nhưng so vs số tiền thì khá ổn mọi người nên mua nha tui mua đc 4k nhưng mà cho ship 6k là 10k nhưng vẫn là rẻ khuyến khích mọi người nên mua và nhớ ủng hộ nha hihihibi,positive,damaged_defective,true,material_comfort,free_text_review,shopee_real_scraped
2287,Mỏng. Ngắn quá . Nói chung là chưa đc hài lòng lắm hình ảnh chỉ mang tính chất minh họa,positive,no_issue,false,,free_text_review,shopee_real_scraped
2288,Bao tay mỏng ten và gắn đồ dỏm mua về không sử dụng được vô thùng rác rồi,negative,material_comfort,false,,free_text_review,shopee_real_scraped
2289,"Chất liệu: mỏng, dễ rách Đúng với mô tả: nhỏ hơn tưởng tượng Màu sắc: đen sản phẩm ko như mong đợi, nhỏ, mỏng, dễ rách",negative,damaged_defective,true,material_comfort,free_text_review,shopee_real_scraped
2290,Mình thấy nó hơi mỏng ở ngoài cửa hàng bán 20k trên này bán 3k chất lượng kém,negative,material_comfort,false,,free_text_review,shopee_real_scraped
2291,Đúng với mô tả: dùng được có mấy ngày là rách Chất liệu: ko hài lòng Màu sắc: ko giống,positive,no_issue,true,damaged_defective,free_text_review,shopee_real_scraped
2292,"Màu sắc: Bao tay mỏng dính và ngắn ngủn luôn.Quá thất vọng về sp, mua về nhưng ko sử dụng dc",negative,damaged_defective,true,material_comfort,free_text_review,shopee_real_scraped
2293,Đúng với mô tả: hình ảnh chỉ mang tính chất nhận xu Chất liệu: mỏng quá,negative,material_comfort,false,,free_text_review,shopee_real_scraped
2294,Màu sắc: đen Ngắn quá khác ảnh kh nên mua ạ👎,positive,no_issue,false,,free_text_review,shopee_real_scraped
2295,Màu sắc: mongr uwas kh nch kx dokf gc f mmt qohd eubh kn e cun rh ôq gin r dukwn chh,neutral,color_design,false,,free_text_review,shopee_real_scraped
2296,Giao thiếu mất 1 đôi găng tay,negative,wrong_missing_item,true,shipping_delivery,free_text_review,shopee_real_scraped
2297,dễ rách nhưng dùng tạm ổn,negative,damaged_defective,false,,free_text_review,shopee_real_scraped
2298,"Sp quá mỏng, quá ngắn đeo qua cùi chỏ xíu",negative,material_comfort,false,,free_text_review,shopee_real_scraped
2299,Màu sắc: da Chất liệu: mỏng Đúng với mô tả: khg,positive,no_issue,true,material_comfort,free_text_review,shopee_real_scraped
2300,Chất liệu: mỏng hơi dễ rách có nhiều chỉ thừa,negative,damaged_defective,true,material_comfort,free_text_review,shopee_real_scraped
2301,Vải ko đc cho lắm,neutral,no_issue,false,,free_text_review,shopee_real_scraped
2302,Đúng với mô tả: Ko Màu sắc: đen Chất liệu: mỏng Đúng với mô tả:Ko Màu sắc:đen Chất liệu:mỏng,positive,no_issue,true,material_comfort,free_text_review,shopee_real_scraped
2303,"Chất liệu mỏng, Ko mua lại lần 2",positive,no_issue,false,,free_text_review,shopee_real_scraped
2304,gang tay hơi ngắn so với hình,neutral,no_issue,false,,free_text_review,shopee_real_scraped
2305,Quá mỏng mỏng dính thế này thì chống nắng kiểu gì,negative,material_comfort,false,,free_text_review,shopee_real_scraped
2306,Ko giống như trên mạng,neutral,damaged_defective,false,,free_text_review,shopee_real_scraped
2307,Ngắn và chật,neutral,size_fit,false,,free_text_review,shopee_real_scraped
2308,Wá ngắn wá mỏng,neutral,material_comfort,false,,free_text_review,shopee_real_scraped
2309,"Chất liệu: mong,de rach",neutral,material_comfort,false,,free_text_review,shopee_real_scraped
2310,Ko giống miu ta,neutral,no_issue,false,,free_text_review,shopee_real_scraped
2311,SP cung dc,neutral,no_issue,false,,free_text_review,shopee_real_scraped
2312,Rất mỏng,negative,material_comfort,false,,free_text_review,shopee_real_scraped
2313,Mỏg lm,neutral,spam_irrelevant,false,,spam_irrelevant,shopee_real_scraped
2314,Mỏng,negative,material_comfort,false,,free_text_review,shopee_real_scraped
2315,Tốt,positive,no_issue,false,,free_text_review,shopee_real_scraped
2316,"Sản phẩm: Sản phẩm không như mô tả, Sản phẩm chất lượng kém",negative,damaged_defective,false,,free_text_review,shopee_real_scraped
2317,"Lần đầu trải nghiệm mua sản phẩm của hãng kh ngờ hãng lại đóng gói rất sơ xài tiếc cả 1 cái hộp giấy nhìn đống ngòi bị bể tùm lum là chả muốn khui tiếp nữa ( lần đầu cũng là lần cuối mua ở shop , mua hàng sp mấy năm nay đây là lần đầu e đánh giá 1 sao sp mà m mua)",negative,packaging,true,damaged_defective,free_text_review,shopee_real_scraped
2318,"viết tạm được nhưng không mượt, giá chát, sẽ không bao giờ mua lại",negative,damaged_defective,false,,free_text_review,shopee_real_scraped
2319,"2 bút còn lại cũng kiểu mới mà thấy ngòi kiểu khác, mỗi cái này dùng cái loại ngòi lỏng lẻo chán",negative,color_design,false,,free_text_review,shopee_real_scraped
2320,"Chất lượng sản phẩm: ok, đồ deli thì xịn khỏi bàn rùi nha Đúng với mô tả: đúng Giao hàng nhanh cực í , mới 2 hay 3 ngày đã đến tay",positive,no_issue,false,,free_text_review,shopee_real_scraped
2321,"Bút xịn, chữ viết đẹp, màu ổn. Nói chung không có gì đáng chê, buồn cái hôm nay mình buồn 21 nqyiqirpjy",positive,no_issue,false,,free_text_review,shopee_real_scraped
2322,Chất lượng sản phẩm: khoong gioongs trên hình của ahop Đúng với mô tả: không ngòi 0.35 viết xấu không mượt. Vỏ bút không như mong đợi thà mua loại MG ni còn viết đẹp mượt hơn á,positive,no_issue,false,,free_text_review,shopee_real_scraped
2323,"Sản phẩm: Sản phẩm không như mô tả, Sản phẩm chất lượng kém, Hàng lỗi hoặc bị hư hỏng Không thích kiểu thiết kế của ngòi bút, còn tệ hơn loại 1-2k ở shop khác luôn á hả bác bạn có thể làm được gì cho mình hỏi thăm",negative,damaged_defective,true,seller_service,free_text_review,shopee_real_scraped
2324,mới đầu tưởng 1 hộp 10k mua về 1 cái thất vọng,negative,packaging,false,,free_text_review,shopee_real_scraped
2325,"Sản phẩm: Sản phẩm chất lượng kém, Sản phẩm không như mô tả hình ảnh minh hoa. ủa alo s dc 1 cái bút v. 1 cái mà bán 12k ảo giá vvl xong lúc ấn thêm giỏ hàng cx k ghi cụ thể là bao nhiêu cái rất gà mờ nhé",negative,damaged_defective,true,material_comfort,free_text_review,shopee_real_scraped
2326,Chất lượng sản phẩm: tạm Mới viết một lúc bút đã bị tắc rồi tệ quá tệ,negative,product_quality,false,,free_text_review,shopee_real_scraped
2327,bút giao về có bọc chống sốc nhưng mực vẫn chảy 🙂 3 h*****5,positive,packaging,true,shipping_delivery,free_text_review,shopee_real_scraped
2328,Chất lượng sản phẩm: trời ơi thấy vọng thiệt chứ Đúng với mô tả: mong shop rep đánh giá Chưa lấy đc hàng Shipper ăn cắp hàng,negative,shipping_delivery,true,damaged_defective,free_text_review,shopee_real_scraped
2329,Chất lượng sản phẩm: shopee mall tệ nhất Shopee mall làm ăn v đó. Mấy cây bút xài r còn ko trầy xước kiểu vậy. Mở ra thèm giục hết sức. Cây viết trong xước mà thành đục luôn. Tức thiệt chứ,negative,color_design,false,,free_text_review,shopee_real_scraped
2330,"bút đỏ viết không đẹp, mực ra đậm quá lâu khô nữa bút xanh đỡ hơn",negative,color_design,false,,free_text_review,shopee_real_scraped
2331,sài dễ đứt mực quá mình mua 3 cây + 10 ngòi mà sài gần tuần thay hết 4 ngòi rồi. Viết chút là đứt mực 1 e*****p,negative,damaged_defective,false,,free_text_review,shopee_real_scraped
2332,"Chất lượng sản phẩm: tốt Đúng với mô tả: 90% mực lâu khô vậy, để khoảng trên dưới 10s mà chạm vào vẫn còn lem",positive,no_issue,false,,free_text_review,shopee_real_scraped
2333,Mua tưởng 8k 4 cái bút mà 8k đc 1 cái. Lúc xem là 2k 1 cái tưởng 4 cái 8k. Đúng là bịp. Treo đầu dê bán thịt chó,neutral,no_issue,false,,free_text_review,shopee_real_scraped
2334,Đúng với mô tả: ok Chất lượng sản phẩm: ok Bút viết đẹp lắm mình sẽ không ủng hộ nữa vì quá sợ hãi rồi mk đặt thấy kiểu mang về là một hộp ai ngờ giao về 1 cái bút mà tận 40k may có mã ko là 50k sợ rồi lên lần sau sẽ ko mua nữa chú í trước khi mua nhé,positive,no_issue,true,shipping_delivery,free_text_review,shopee_real_scraped
2335,màu mực cấu nét xấu k đều cocn bị nhoè mực chán lắm k lên mua :) chán,neutral,color_design,false,,free_text_review,shopee_real_scraped
2336,"Chất lượng sản phẩm: lỗi Đúng với mô tả: ko Sản phẩm: Sản phẩm không như mô tả, Hàng lỗi hoặc bị hư hỏng giao cho cái bút ngòi bị hỏng lên mình bỏ ra rồi cái bút có mấy nghìn lên th cũng chẳng thèm trả làm j🙂",negative,damaged_defective,true,shipping_delivery,free_text_review,shopee_real_scraped
2337,"Giao thiếu hàng và sai luôn cả mẫu mã, shop uy tín mà không uy tín j cả, lần sau sẽ ko bao h quay lại shop này nữa",negative,wrong_missing_item,true,shipping_delivery,free_text_review,shopee_real_scraped
2338,Quảng cáo như con c bút viết tắc mực mực ko ra đều 1 sao là đúng 😡😡😡😡,neutral,damaged_defective,false,,free_text_review,shopee_real_scraped
2339,Tưởng bán cả hộp ai dè đc 1 chiếc bút mà mất mấy chục bạc,neutral,packaging,false,,free_text_review,shopee_real_scraped
2340,Chất lượng sản phẩm: có nhận dc đôu mờ Đúng với mô tả: hong bích tố cáo shipper lấy hàng của khách :((,negative,shipping_delivery,false,,free_text_review,shopee_real_scraped
2341,Nhân hàng mà chán luôn,neutral,no_issue,false,,free_text_review,shopee_real_scraped
2342,Chất lượng sản phẩm: được Đúng với mô tả: Không Tớ tưởng là 1 hộp chứ ạ? Bán mà không đặt tên sản phẩm cho rõ nên em đặt hàng nhầm,positive,no_issue,false,,free_text_review,shopee_real_scraped
2343,mo còn tưởng là 1 hộp ai ngờ chỉ có 1 chiếc,neutral,packaging,false,,free_text_review,shopee_real_scraped
2344,1 a7d2g6hmla,neutral,no_issue,false,,free_text_review,shopee_real_scraped
2345,Chất lượng sản phẩm: đặt 2 hộp bút mà giáo cod 2 cây Chất lượng sản phẩm:đặt 2 hộp bút mà giao có 2 cây ko nên mua shop này nha nha mọi người,positive,no_issue,true,shipping_delivery,free_text_review,shopee_real_scraped
2346,Chất lượng sản phẩm: giao nhầm với ngòi xanh Đúng với mô tả: không đúng,positive,no_issue,false,,free_text_review,shopee_real_scraped
2347,"Mình mua cái dao loại có lò xo tự động, nó không cố định được mà phải liên tục nhấn giữ vô cùng bất tiện. Đã thế lưỡi dao còn ngắn có tí không như các loại truyền thống làm sự bất tiện bực bội x2. Không hiểu sao thiết kế được con dao đi vào lòng đất như thế. Nói chung mua về thấy ghét dùng mua bực người nên sẽ quyết định vứt đi mua lại loại khác",positive,no_issue,false,,free_text_review,shopee_real_scraped
2348,"Trên ảnh mô tả thì để hộp có 3c xong giao 1c không hộp, shop mall mà làm ăn chộp giật",neutral,packaging,true,shipping_delivery,free_text_review,shopee_real_scraped
2349,Đúng với mô tả: kh đúng ảnh shop là 1 hộp nhưng về hàng chỉ có 1 cái mng nên chú ý khi mua hàng ạ,positive,packaging,true,damaged_defective,free_text_review,shopee_real_scraped
2350,Đúng với mô tả: không đúng với mô tả trên ảnh shop là 1 hộp nhưng về chỉ là 1 cái mng nên chú ý khi mua hàng ạ,positive,packaging,true,damaged_defective,free_text_review,shopee_real_scraped
2351,"Chất lượng sản phẩm: ra mực đều Đúng với mô tả: đúng Huhu nhưbg mà t tưởng là 2 set mà lúc về có 2 cái, tận 44k liền xót tiền quaaa :<<",positive,no_issue,false,,free_text_review,shopee_real_scraped
2352,"Mực bút ch viết bao lâu đã không đều mực lúc đậm lúc nhạt , có khi còn tắt mực, mua về để thay ruột kà không ổn tí nào",neutral,no_issue,false,,free_text_review,shopee_real_scraped
2353,Giao nhầm sp ko đúng miêu tả,neutral,no_issue,false,,free_text_review,shopee_real_scraped
2354,bút ra nhiều mực quá ạ!!!,neutral,no_issue,false,,free_text_review,shopee_real_scraped
2355,Chất lượng sản phẩm: tệ Đúng với mô tả: không đúng với mô tả,negative,product_quality,false,,free_text_review,shopee_real_scraped
2356,"thật sự thất vọng và mong shop giải quyết , đặt bút giao tẩy ?",negative,seller_service,true,shipping_delivery,free_text_review,shopee_real_scraped
2357,"Cái bút mới về 1 ngày mà đứt cái ngòi luôn r má :))) k hiểu thế nào luôn, may là rẻ chứ k chắc tức chớt",negative,damaged_defective,false,,free_text_review,shopee_real_scraped
2358,Đúng với mô tả: tạm Chất lượng sản phẩm: tệ Ibyxrxtvubk8ubyctx527555ydrt hgyxxtyvubhnkbctv,negative,product_quality,false,,free_text_review,shopee_real_scraped
2359,"Giao ai mã , đặt A057 giao S60 vậy",neutral,no_issue,false,,free_text_review,shopee_real_scraped
2360,Mất công đặt mà không nhận được hàng ăn luôn được,negative,no_issue,false,,free_text_review,shopee_real_scraped
2361,"Shop làm ăn buồn cười thật,bảo là chưa giao mà chẳng thấy phản hồi j.Thằng shipper nó chưa giao hàng cho tôi mà nó dám chụp đơn hàng của người khác rồi bảo là giao rồi",neutral,shipping_delivery,true,damaged_defective,free_text_review,shopee_real_scraped
2362,Chưa nhận đc hàng nhưng lại báo đơn hàng thành công,positive,damaged_defective,false,,free_text_review,shopee_real_scraped
2363,Đúng với mô tả: không Ủa 1 hộp có 1 cây vạy ạ? Mua 5 hợp đc 5 cây 1 cây 10k à còn ship nữa Rất tệ,negative,packaging,false,,free_text_review,shopee_real_scraped
2364,"bút nhanh tắc mực hơn cả the flash :))) kiểu dùng được 1 lúc là lại tắc , vẫy vẫy cũng k được mà thổi mực cũng k xong",neutral,color_design,false,,free_text_review,shopee_real_scraped
2365,"Gửi ddC thì mực chảy hết cả ra ,lần đầu mua đã ko ưng",positive,no_issue,false,,free_text_review,shopee_real_scraped
2366,Bút ngòi thì tắc mực dùng chán lắm k giải quyết đc thiếu hàng thiếu tièn cho mình shop lớn mà làm chán lắm không ra gì không đáng mua chê,negative,wrong_missing_item,true,seller_service,free_text_review,shopee_real_scraped
2367,Dùng bình thường còn cs 1 số cái bị tắc mực và rơi cũng rất dễ bị tắc mực,neutral,damaged_defective,false,,free_text_review,shopee_real_scraped
2368,"Chụp ảnh 5 cái bút mà giao có 1 cái, ko uy tín, đáng 1 sao",neutral,no_issue,false,,free_text_review,shopee_real_scraped
2369,Chất lượng sản phẩm: k như hình viết bị nhoè rất khó chịu😀,negative,damaged_defective,false,,free_text_review,shopee_real_scraped
2370,"Chất lượng sản phẩm: bút quá gai, viết k ra đều mực, phí tiền :)",negative,price_value,false,,free_text_review,shopee_real_scraped
2371,Chất lượng sản phẩm: ddc Đúng với mô tả: không Đặt 1 hộp về có 1c,positive,no_issue,false,,free_text_review,shopee_real_scraped
2372,Ko thích hợp để mua viết tiếng trung Nhạt và mờ Chê !!!!!!,positive,no_issue,false,,free_text_review,shopee_real_scraped
2373,mẹ t đặt 3 cái bút 10 cái ngòi mà giao đúng 3 cái bút=)),neutral,no_issue,false,,free_text_review,shopee_real_scraped
2374,Tôi muốn mua 1 hộp nhưng chỉ bán 1 cái,positive,packaging,false,,free_text_review,shopee_real_scraped
2375,"Viết hay bị tắt mực, mực ra không đều và mỗi lần viết đều cảm giác k thoải mái",positive,no_issue,false,,free_text_review,shopee_real_scraped
2376,Tưởng 2 hộp ai ngờ là 2 Bút shop lừa đảo mất tiền oan chừa cái shop này ra nhé mn,negative,packaging,true,price_value,free_text_review,shopee_real_scraped
2377,Thử random 3 cây từ 3 hộp khác nhau trên giấy klong đều không ra đều mực,neutral,packaging,false,,free_text_review,shopee_real_scraped
2378,Đúng với mô tả: sao mua bút lại ra ngòi ????,positive,no_issue,false,,free_text_review,shopee_real_scraped
2379,"Đúng với mô tả: ổn ổn, nhưng shop lấy bị thiếu",positive,damaged_defective,true,wrong_missing_item,free_text_review,shopee_real_scraped
2380,Đống gói hàng ko cẩn thận,neutral,packaging,false,,free_text_review,shopee_real_scraped
2381,"Bút ra mực ko đều , bị tắt mực . Với giá $$$ như vậy thì hơi đắt mà ko chất lượng nx",negative,damaged_defective,false,,free_text_review,shopee_real_scraped
2382,Đúng với mô tả: ko Chất lượng sản phẩm: tệ Mực ko ra đều,negative,product_quality,false,,free_text_review,shopee_real_scraped
2383,Bút viết thì bình thường thậm trí còn dễ tắc mực giá thành thì cao cũng xứng đáng 1*,neutral,damaged_defective,false,,free_text_review,shopee_real_scraped
2384,"Chất lượng sản phẩm: khong tot Đúng với mô tả: bình thường Ngòi hay tắc mua năm cái tắc 3 rồi dùng gì nữa, hàng kém chất lượng thật sự lần sau sẽ không mua nữa",negative,damaged_defective,false,,free_text_review,shopee_real_scraped
2385,"Shipper hãm l vãi 😀?? Mẹ đã bảo đi học mai giao rồi xong cho đã giao hàng luôn?. mẹ 4 nghìn nhưng mà t nhận đc còn hơn mấy bọn boom rồi, còn thái độ cái khỉ mẹ gì??",positive,shipping_delivery,false,,free_text_review,shopee_real_scraped
2386,Đúng với mô tả: chưa bt Chất lượng sản phẩm: chưa bt Tôi đặt cái bút này lần 2 vẫn ko nhận đc hàng trong khi đơn hàng đã giai thành công,positive,no_issue,false,,free_text_review,shopee_real_scraped
2387,shop đóng thiếu 2 cái bút của mình a101 với a60,neutral,seller_service,true,wrong_missing_item,free_text_review,shopee_real_scraped
2388,"Đúng với mô tả: Khong tot Chất lượng sản phẩm: Khong tot Bút viết rất gai, viết được mấy hôm không ra mực nữa luôn 🙃",positive,no_issue,false,,free_text_review,shopee_real_scraped
2389,Bút viết đc chút lại tắc mực rồi ko viết đc nx,neutral,no_issue,false,,free_text_review,shopee_real_scraped
2390,Một hộp 2 mà nhận 1,neutral,packaging,false,,free_text_review,shopee_real_scraped
