source_file,page,review_text,cleaned_review,sentiment,model_sentiment,sentiment_rule,issue,issue_candidate,score,matched_patterns,needs_human_review,review_note,review_status
shopee_issue_candidates.csv,9,"Công dụng: xà phòng tắm Phù hợp với loại da: các loại da Mùi hương: nhẹ mjk đặt than tre loại mới nhưng sop lại gửi mẫu cũ và giá rẻ hơn, hộp chuyển hàng về thì móp méo, chai lọ thì móp, khâu đóng hàng mà quá tệ, may là không gãy vòi bể chai, nếu có âm sẽ cho sop âm sao 0:15",công dụng xà phòng tắm phù hợp với loại da các loại da mùi hương nhẹ mjk đặt than tre loại mới nhưng shop lại gửi mẫu cũ và giá rẻ hơn hộp chuyển hàng về thì móp méo chai lọ thì móp khâu đóng hàng mà quá tệ may là khong gãy vòi bể chai nếu có âm sẽ cho shop âm sao 0 15,negative,negative,clear_negative_rule,packaging,packaging,1,hop vo,False,keep_candidate; clear_complaint_negative,reviewed_by_rule_and_context
shopee_issue_candidates.csv,10,Công dụng: .. Mùi hương: Tưởng shop u tín gì đâu. Phù hợp với loại da: . Thấy treo biển mua 1 tặng 1 nên bấm vào mua mặc dù shop khác bán 130k. Nhưng khi thêm vào giỏ hàng và đặt hàng lại chỉ nhận được 1 chai. Không có quà tặng. Báo shop thì shop kêu là lỗi lại mình không biết cách bấm mua nên chỉ nhận dc 1 chai. Chịu thua. Này có giống treo đầu rê bán thịt chó không cơ chứ. Lươn lẹo. Bực mình. 0:05,công dụng mùi hương tưởng shop u tín gì đâu phù hợp với loại da thấy treo biển mua 1 tặng 1 nên bấm vào mua mặc dù shop khác bán 130k nhưng khi thêm vào giỏ hàng và đặt hàng lại chỉ nhận duoc 1 chai khong có quà tặng báo shop thì shop kêu là lỗi lại mình khong biết cách bấm mua nên chỉ nhận duoc 1 chai chịu thua này có giống treo đầu rê bán thịt chó khong cơ chứ lươn lẹo bực mình 0 05,negative,negative,,wrong_missing_item,packaging,1,hop vo,False,wrong_missing_item_priority_rule; issue_candidate_default_negative,reviewed_by_rule_and_context
shopee_issue_candidates.csv,10,"Công dụng: tắm Mùi hương: khổ qua Mình dùng hóa mỹ phẩm của Uni bao nhiêu năm nay rồi. Lần này mua hàng qua sàn để săn mã giảm giá của shopee. Nhưng shop đóng gói tệ quá. Trải nghiệm mua sắm quá tệ. Dầu gội chảy hết ra thùng, dính đầy ra các chai khác. Kem đánh răng có chống shock thì bọc sơ sài. 0:04",công dụng tắm mùi hương khổ qua mình dùng hóa mỹ phẩm của uni bao nhiêu năm nay rồi lần này mua hàng qua sàn để săn mã giảm giá của shopee nhưng shop đóng gói tệ quá trải nghiệm mua sắm quá tệ dầu gội chảy hết ra thùng dính đầy ra các chai khác kem đánh răng có chống shock thì bọc sơ sài 0 04,negative,negative,clear_negative_rule,packaging,packaging,1,dong goi te,False,packaging_priority_rule; clear_complaint_negative,reviewed_by_rule_and_context
shopee_issue_candidates.csv,11,Đặt bao nhiều lần rồi mà lần này bọc rất ẩu. Ko dán băng keo để cố định nắp và cũng ko có chống sốc cọc sản phẩm. Vận chuyển xa bung nắp đổ cả chai sữa tắm 0:14,đặt bao nhiều lần rồi mà lần này bọc rất ẩu khong dán băng keo để cố định nắp và cũng khong có chống sốc cọc san pham vận chuyển xa bung nắp đổ cả chai sữa tắm 0 14,negative,negative,,packaging,packaging,1,khong co chong soc,False,packaging_priority_rule; clear_complaint_negative,reviewed_by_rule_and_context
shopee_issue_candidates.csv,12,"Shop đóng gói không chắc chắn, sữa tắm đổ tùm lum hết trơn, nhưng mà mùi thơm Nứt cả đáy, shop mall làm ăn vậy á 0:08 2 do_tam_1991",shop đóng gói khong chắc chắn sữa tắm đổ tùm lum hết trơn nhưng mà mùi thơm nứt cả đáy shop mall làm ăn vậy á 0 08 2 do tam 1991,negative,negative,clear_negative_rule,packaging,packaging,1,dong goi khong chac,False,packaging_priority_rule; clear_complaint_negative,reviewed_by_rule_and_context
shopee_issue_candidates.csv,12,Công dụng: lo Phù hợp với loại da: ko Mùi hương: ko Em dặn giao chai sản xuất mới mà sao lại đưa loại cũ v ạ ???? 0:14,công dụng lo phù hợp với loại da khong mùi hương khong em dặn giao chai sản xuất mới mà sao lại đưa loại cũ v ạ 0 14,negative,negative,,packaging,packaging,1,hop vo,False,keep_candidate; issue_candidate_default_negative,reviewed_by_rule_and_context
shopee_issue_candidates.csv,13,Phù hợp với loại da: sữa tắm Mùi hương: sữa tắm Công dụng: sữa tắm K hài lòng k có tặng quà thất vọng 0:04,phù hợp với loại da sữa tắm mùi hương sữa tắm công dụng sữa tắm khong hài lòng khong có tặng quà thất vọng 0 04,negative,negative,clear_negative_rule,packaging,packaging,1,hop vo,False,keep_candidate; clear_complaint_negative,reviewed_by_rule_and_context
shopee_issue_candidates.csv,14,Giao hàng nhanh Đóng gói không cẩn thận Chai khổ qua matcha thì chỉ có được 2/3 Chai quà tặng thì chỉ có nửa chai Nói chung là làm ăn chán Không quay lại lần 2 0:04 2 linh088201,giao hàng nhanh đóng gói khong cẩn thận chai khổ qua matcha thì chỉ có duoc 2 3 chai quà tặng thì chỉ có nửa chai nói chung là làm ăn chán khong quay lại lần 2 0 04 2 linh088201,negative,negative,clear_negative_rule,packaging,packaging,1,dong goi khong can than,False,packaging_priority_rule; clear_complaint_negative,reviewed_by_rule_and_context
shopee_issue_candidates.csv,14,Shop giao cho chai bị thủng đáy. K biết do shop hay do bên vận chuyển làm hư hại sản phẩm. Nhắn tin thì shop k trả lời. Shop mall nhưng làm ăn k bằng những shop lẻ. Chắm sóc khách hàng quá tệ. 0:07,shop giao cho chai bị thủng đáy khong biết do shop hay do bên vận chuyển làm hư hại san pham nhắn tin thì shop khong trả lời shop mall nhưng làm ăn khong bằng những shop lẻ chắm sóc khách hàng quá tệ 0 07,negative,negative,clear_negative_rule,seller_service,seller_service,1,khong tra loi,False,seller_service_priority_rule; clear_complaint_negative,reviewed_by_rule_and_context
shopee_issue_candidates.csv,14,"Giao hàng cực kỳ lâu, 4 ngày mới giao cho đơn vị vận chuyển. Đóng gói tệ : hộp bên ngoài bị nhàu nát, chống sốc bên trong mềm nhũn ko có tác dụng chống sốc. 0:19",giao hàng cực kỳ lâu 4 ngày mới giao cho đơn vị vận chuyển đóng gói tệ hộp bên ngoài bị nhàu nát chống sốc bên trong mềm nhũn khong có tác dụng chống sốc 0 19,negative,negative,clear_negative_rule,packaging,packaging,1,dong goi te,False,packaging_priority_rule; clear_complaint_negative,reviewed_by_rule_and_context
shopee_issue_candidates.csv,16,"Mùi hương: thơm dịu nhẹ Công dụng: làm sạch da giảm mụn chút xíu Phù hợp với loại da: mọi loại da Hộp đựng hàng thì móp méo rách, sản phẩm thì quấn băng dính trông mất thẩm mĩ quá, hàng tặng thì được nửa lọ mà bán đắt. Buồn mỗi khâu đóng gói 0:07",mùi hương thơm dịu nhẹ công dụng làm sạch da giảm mụn chút xíu phù hợp với loại da mọi loại da hộp đựng hàng thì móp méo rách san pham thì quấn băng dính trông mất thẩm mĩ quá hàng tặng thì duoc nửa lọ mà bán đắt buồn mỗi khâu đóng gói 0 07,negative,negative,,packaging,packaging,1,hop vo,False,keep_candidate; issue_candidate_default_negative,reviewed_by_rule_and_context
shopee_issue_candidates.csv,16,Công dụng: SUa tam Mùi hương: Mui matcha thom Phù hợp với loại da: co Đóng gói quá sơ sài vận chuyển đến mình thì bị chảy sữa tắm ra ngoài 0:06 1 khiem1210,công dụng sua tam mùi hương mui matcha thom phù hợp với loại da co đóng gói quá sơ sài vận chuyển đến mình thì bị chảy sữa tắm ra ngoài 0 06 1 khiem1210,negative,negative,,packaging,packaging,1,hop vo,False,keep_candidate; issue_candidate_default_negative,reviewed_by_rule_and_context
