source_file,page,review_text,cleaned_review,sentiment,model_sentiment,sentiment_rule,issue,issue_candidate,score,matched_patterns,needs_human_review,review_note,review_status
shopee_issue_candidates (2).csv,116,"Chất lượng sản phẩm: không tốt Ko kết nối đc với định vị ko kiếm đc nên khuyến cáo lội người đường mua để tránh lãng phí tiền như tôi!! Ugreen Thẻ Thông Minh Định Vị Thông Minh Chống Mất Bluetooth5.0 Finder Airtag Theo Dõi Finder Định Vị Cho iPhone / iPad / Mac 1 1 2 114 115 116 117 118 DỊCH VỤ KHÁCH HÀNG Trung Tâm Trợ Giúp Shopee Shopee Blog Shopee Mall Hướng Dẫn Mua Hàng/Đặt Hàng Hướng Dẫn Bán Hàng Ví ShopeePay Shopee Xu Đơn Hàng Trả Hàng/Hoàn Tiền Liên Hệ Shopee Chính Sách Bảo Hành SHOPEE VIỆT NAM Về Shopee Tuyển Dụng Điều Khoản Shopee Chính Sách Bảo Mật Shopee Mall Kênh Người Bán Flash Sale Tiếp Thị Liên Kết Liên Hệ Truyền Thông THANH TOÁN ĐƠN VỊ VẬN CHUYỂN THEO DÕI SHOPEE Facebook Instagram LinkedIn TẢI ỨNG DỤNG SHOPEE © 2026 Shopee. Tất cả các quyền được bảo lưu. Quốc gia & Khu vực: Argentina Singapore Indonesia Thái Lan Malaysia Việt Nam Philippines Brazil México Đài Loan CHÍNH SÁCH BẢO MẬT QUY CHẾ HOẠT ĐỘNG CHÍNH SÁCH VẬN CHUYỂN CHÍNH SÁCH TRẢ HÀNG VÀ HOÀN TIỀN Công ty TNHH Shopee Địa chỉ: Tầng 4-5-6, Tòa nhà Capital Place, số 29 đường Liễu Giai, Phường Ngọc Hà, Thành phố Hà Nội, Việt Nam Chăm sóc khách hàng: Gọi tổng đài Shopee (miễn phí) hoặc Trò chuyện với Shopee ngay trên Trung tâm trợ giúp Chịu Trách Nhiệm Quản Lý Nội Dung: Nguyễn Bùi Anh Tuấn Mã số doanh nghiệp: 0106773786 do Sở Kế hoạch và Đầu tư TP Hà Nội cấp lần đầu ngày 10/02/2015 © 2015 - Bản quyền thuộc về Công ty TNHH Shopee 2",chất lượng san pham khong tốt khong kết nối duoc với định vị khong kiếm duoc nên khuyến cáo lội người đường mua để tránh lãng phí tiền như tôi ugreen thẻ thông minh định vị thông minh chống mất bluetooth5 0 finder airtag theo dõi finder định vị cho iphone ipad mac 1 1 2 114 115 116 117 118 dịch vụ khách hàng trung tâm trợ giúp shopee shopee blog shopee mall hướng dẫn mua hàng đặt hàng hướng dẫn bán hàng ví shopeepay shopee xu đơn hàng trả hàng hoàn tiền liên hệ shopee chính sách bảo hành shopee việt nam về shopee tuyển dụng điều khoản shopee chính sách bảo mật shopee mall kênh người bán flash sale tiếp thị liên kết liên hệ truyền thông thanh toán đơn vị vận chuyển theo dõi shopee facebook instagram linkedin tải ứng dụng shopee 2026 shopee tất cả các quyền duoc bảo lưu quốc gia khu vực argentina singapore indonesia thái lan malaysia việt nam philippines brazil méxico đài loan chính sách bảo mật quy chế hoạt động chính sách vận chuyển chính sách trả hàng và hoàn tiền công ty tnhh shopee địa chỉ tầng 4 5 6 tòa nhà capital place số 29 đường liễu giai phường ngọc hà thành phố hà nội việt nam chăm sóc khách hàng gọi tổng đài shopee miễn phí hoặc trò chuyện với shopee ngay trên trung tâm trợ giúp chịu trách nhiệm quản lý nội dung nguyễn bùi anh tuấn mã số doanh nghiệp 0106773786 do sở kế hoạch và đầu tư tp hà nội cấp lần đầu ngày 10 02 2015 2015 bản quyền thuộc về công ty tnhh shopee 2,negative,negative,clear_negative_rule,product_quality,price_value,1,phi tien,False,product_quality_priority_rule; clear_complaint_negative,reviewed_by_rule_and_context
shopee_issue_candidates (2).csv,117,"Về dùng 1-2 tuần thì nghe chất lượng âm thanh rất kém, tai nghe bên được bên không. Liên lạc với shop thì không trả lời. Thời gian bảo hành 18 tháng coi như ko có bảo hành. Người nào mua sản phẩm này cần xem thật kỹ, trông bóng bẩy quảng cáo đẹp nhưng thực sự chất lượng thua luôn cái tai nghe 50-7 chục. Hãy tin cảnh báo của tôi. Ugreen Dụng Cụ Cố Định Dây Cáp 14cm Cho Chuột Tai Nghe HDMI Aux USB",về dùng 1 2 tuần thì nghe chất lượng âm thanh rất kém tai nghe bên duoc bên khong liên lạc với shop thì khong trả lời thời gian bảo hành 18 tháng coi như khong có bảo hành người nào mua san pham này cần xem thật kỹ trông bóng bẩy quảng cáo đẹp nhưng thực sự chất lượng thua luôn cái tai nghe 50 7 chục hãy tin cảnh báo của tôi ugreen dụng cụ cố định dây cáp 14cm cho chuột tai nghe hdmi aux usb,negative,negative,,seller_service,seller_service,1,khong tra loi,False,seller_service_priority_rule; clear_complaint_negative,reviewed_by_rule_and_context
shopee_issue_candidates (2).csv,119,Quá khó sử dụng lại không có video hướng dẫn chỉ tiết. Nhắn shop thì không trả lời UGREEN Tempered Glass HD Films for iPhone 16 Pro Max Glass Screen Protector for iPhone 16 Pro UGREEN Tempered Glass HD Films for iPhone 16 Pro Max Glass Screen Protector for iPhone 16 Pro,quá khó sử dụng lại khong có video hướng dẫn chỉ tiết nhắn shop thì khong trả lời ugreen tempered glass hd films for iphone 16 pro max glass screen protector for iphone 16 pro ugreen tempered glass hd films for iphone 16 pro max glass screen protector for iphone 16 pro,negative,negative,,seller_service,seller_service,1,khong tra loi,False,seller_service_priority_rule; clear_complaint_negative,reviewed_by_rule_and_context
shopee_issue_candidates (2).csv,119,"Đã xem video hướng dẫn, làm đủ tất cả các bước thì phát hiện ra là miếng dán bị dính chặt vào miếng số 1 lúc bóc ra. Thế là hỏng luôn 1 miếng. Miếng thứ hai thì không bị, nhưng sau khi miết theo hướng dẫn và bóc miếng số 2 ra thì phần miếng dán chính cũng dính theo miếng số 2 mà không dính vào mặt đồng hồ. Nói chung là tương đối mất công ngồi xem video hướng dẫn rồi làm theo xong gặp cảnh này. Thực sự là chất lượng quá tệ so với giá tiền. Miếng dán bảo vệ màn hình UGREEN 2Pack cho Apple Watch Series 9 8 7 44mm / Series SE 6 5 4 44mm, Độ phân giải cao, Không bong bóng, Phim TPU linh hoạt trong suốt, Lắp đặt dễ dàng, cho iWatch 44 / 40mm",đã xem video hướng dẫn làm đủ tất cả các bước thì phát hiện ra là miếng dán bị dính chặt vào miếng số 1 lúc bóc ra thế là hỏng luôn 1 miếng miếng thứ hai thì khong bị nhưng sau khi miết theo hướng dẫn và bóc miếng số 2 ra thì phần miếng dán chính cũng dính theo miếng số 2 mà khong dính vào mặt đồng hồ nói chung là tương đối mất công ngồi xem video hướng dẫn rồi làm theo xong gặp cảnh này thực sự là chất lượng quá tệ so với giá tiền miếng dán bảo vệ màn hình ugreen 2pack cho apple watch series 9 8 7 44mm series se 6 5 4 44mm độ phân giải cao khong bong bóng phim tpu linh hoạt trong suốt lắp đặt dễ dàng cho iwatch 44 40mm,negative,negative,clear_negative_rule,price_value,shipping_delivery,1,mat don,False,price_value_priority_rule; clear_complaint_negative,reviewed_by_rule_and_context
shopee_issue_candidates (2).csv,120,T chưa từng bao giờ gặp trải nghiệm mua hàng tồi tệ đến vậy Đặt hàng gần 3 tuần mới giao Nhắn tin hỗ trợ khách hàng với thái độ thách thức Chất lượng sản phẩm ok Thái độ phục vụ như qq Ugreen Uno 65W 30W RobotGaN Sạc Nhanh GaN2 Sạc Nhanh RG Bộ Chuyển Đổi Nguồn USB C Nhanh Cho iPhone 16 Pro Max iPhone 15 14 13 Pro Max Samsung S24 S23 Ultra 1 dakota538,t chua từng bao giờ gặp trải nghiệm mua hàng tồi tệ đến vậy đặt hàng gần 3 tuần mới giao nhắn tin hỗ trợ khách hàng với thái độ thách thức chất lượng san pham ok thái độ phục vụ như qq ugreen uno 65w 30w robotgan sạc nhanh gan2 sạc nhanh rg bộ chuyển đổi nguồn usb c nhanh cho iphone 16 pro max iphone 15 14 13 pro max samsung s24 s23 ultra 1 dakota538,negative,negative,,wrong_missing_item,seller_service,1,thai do,False,wrong_missing_item_priority_rule; issue_candidate_default_negative,reviewed_by_rule_and_context
shopee_issue_candidates (2).csv,120,"T chưa từng bao giờ gặp trải nghiệm mua hàng tồi tệ đến vậy Đặt hàng gần 3 tuần mới giao Nhắn tin hỗ trợ khách hàng với thái độ thách thức Chất lượng sản phẩm ok Thái độ phục vụ như qq 【MFi】Đầu chuyển đổi UGREEN USB C sang Lightning PD 20W sạc nhanh thích hợp cho iPhone 11 12 13 14/ iPad Pro Air/ Air Pod Pro 2 1 2 118 119 120 121 122 DỊCH VỤ KHÁCH HÀNG Trung Tâm Trợ Giúp Shopee Shopee Blog Shopee Mall Hướng Dẫn Mua Hàng/Đặt Hàng Hướng Dẫn Bán Hàng Ví ShopeePay Shopee Xu Đơn Hàng Trả Hàng/Hoàn Tiền Liên Hệ Shopee Chính Sách Bảo Hành SHOPEE VIỆT NAM Về Shopee Tuyển Dụng Điều Khoản Shopee Chính Sách Bảo Mật Shopee Mall Kênh Người Bán Flash Sale Tiếp Thị Liên Kết Liên Hệ Truyền Thông THANH TOÁN ĐƠN VỊ VẬN CHUYỂN THEO DÕI SHOPEE Facebook Instagram LinkedIn TẢI ỨNG DỤNG SHOPEE © 2026 Shopee. Tất cả các quyền được bảo lưu. Quốc gia & Khu vực: Argentina Singapore Indonesia Thái Lan Malaysia Việt Nam Philippines Brazil México Đài Loan CHÍNH SÁCH BẢO MẬT QUY CHẾ HOẠT ĐỘNG CHÍNH SÁCH VẬN CHUYỂN CHÍNH SÁCH TRẢ HÀNG VÀ HOÀN TIỀN Công ty TNHH Shopee Địa chỉ: Tầng 4-5-6, Tòa nhà Capital Place, số 29 đường Liễu Giai, Phường Ngọc Hà, Thành phố Hà Nội, Việt Nam Chăm sóc khách hàng: Gọi tổng đài Shopee (miễn phí) hoặc Trò chuyện với Shopee ngay trên Trung tâm trợ giúp Chịu Trách Nhiệm Quản Lý Nội Dung: Nguyễn Bùi Anh Tuấn Mã số doanh nghiệp: 0106773786 do Sở Kế hoạch và Đầu tư TP Hà Nội cấp lần đầu ngày 10/02/2015 © 2015 - Bản quyền thuộc về Công ty TNHH Shopee 2",t chua từng bao giờ gặp trải nghiệm mua hàng tồi tệ đến vậy đặt hàng gần 3 tuần mới giao nhắn tin hỗ trợ khách hàng với thái độ thách thức chất lượng san pham ok thái độ phục vụ như qq mfi đầu chuyển đổi ugreen usb c sang lightning pd 20w sạc nhanh thích hợp cho iphone 11 12 13 14 ipad pro air air pod pro 2 1 2 118 119 120 121 122 dịch vụ khách hàng trung tâm trợ giúp shopee shopee blog shopee mall hướng dẫn mua hàng đặt hàng hướng dẫn bán hàng ví shopeepay shopee xu đơn hàng trả hàng hoàn tiền liên hệ shopee chính sách bảo hành shopee việt nam về shopee tuyển dụng điều khoản shopee chính sách bảo mật shopee mall kênh người bán flash sale tiếp thị liên kết liên hệ truyền thông thanh toán đơn vị vận chuyển theo dõi shopee facebook instagram linkedin tải ứng dụng shopee 2026 shopee tất cả các quyền duoc bảo lưu quốc gia khu vực argentina singapore indonesia thái lan malaysia việt nam philippines brazil méxico đài loan chính sách bảo mật quy chế hoạt động chính sách vận chuyển chính sách trả hàng và hoàn tiền công ty tnhh shopee địa chỉ tầng 4 5 6 tòa nhà capital place số 29 đường liễu giai phường ngọc hà thành phố hà nội việt nam chăm sóc khách hàng gọi tổng đài shopee miễn phí hoặc trò chuyện với shopee ngay trên trung tâm trợ giúp chịu trách nhiệm quản lý nội dung nguyễn bùi anh tuấn mã số doanh nghiệp 0106773786 do sở kế hoạch và đầu tư tp hà nội cấp lần đầu ngày 10 02 2015 2015 bản quyền thuộc về công ty tnhh shopee 2,negative,negative,,wrong_missing_item,seller_service,1,thai do,False,wrong_missing_item_priority_rule; issue_candidate_default_negative,reviewed_by_rule_and_context
shopee_issue_candidates (2).csv,123,"Chuột k tương thích với mac, thái độ phục vụ kém, 1 sao UGREEN Chuột không dây Bluetooth 5.0+2.4G Chuột bấm im lặng không dây 4000DPI dọc tiện dụng cho máy tính xách tay laptop MCBook PC Tablet PAD Windows Mac OS",chuột khong tương thích với mac thái độ phục vụ kém 1 sao ugreen chuột khong dây bluetooth 5 0 2 4g chuột bấm im lặng khong dây 4000dpi dọc tiện dụng cho máy tính xách tay laptop mcbook pc tablet pad windows mac os,negative,negative,,seller_service,seller_service,1,thai do,False,seller_service_priority_rule; clear_complaint_negative,reviewed_by_rule_and_context
shopee_issue_candidates (2).csv,124,"Hàng thì tốt mà thái độ nhãn hàng với khách không tốt, 2 món như nhau mà để 2 mã sp khác nhau, chênh lệch giá nhiều Cáp sạc UGREEN bện nylon Micro USB hỗ trợ sạc nhanh 100cm",hàng thì tốt mà thái độ nhãn hàng với khách khong tốt 2 món như nhau mà để 2 mã san pham khác nhau chênh lệch giá nhiều cáp sạc ugreen bện nylon micro usb hỗ trợ sạc nhanh 100cm,negative,negative,,seller_service,seller_service,1,thai do,False,seller_service_priority_rule; clear_complaint_negative,reviewed_by_rule_and_context
shopee_issue_candidates (2).csv,125,Ko trả lời câu hỏi người mua. Chỉ để tin nhắn tự động,khong trả lời câu hỏi người mua chỉ để tin nhắn tự động,negative,negative,,seller_service,seller_service,1,khong tra loi,False,seller_service_priority_rule; clear_complaint_negative,reviewed_by_rule_and_context
shopee_issue_candidates (2).csv,127,"Đúng với mô tả: lừa đảo không đổi bảo hành Chất lượng sản phẩm: shop cố tình không trả bảo hành Mình đặt thêm 1 đơn hàng để report shop này Mua cục sạc 65w chứ hết 12 tháng hỏng Liên hệ shop hỗ trợ đồng ý đổi sản phẩm mới để bảo hành, mình đã cung cấp 2 video sản phẩm k lên điện và nhúng nước sản phẩm để chắc chắn k sử dụng được Tuy nhiên shop gửi cho m 1 mã giảm giá = giá trị sản phẩm để đặt đơn hoàn nhưng k sử dụng được Sau khi liên hệ lai shop khẳng định mình đã sử dụng mã giảm giá rồi trong khi mình không đặt và có liên hệ nhưng shop k trả lời Mình đã liên hệ cskh shopee xác nhận mã đơn shop gửi không phải do mình đặt Shop tiếp tục không trả lời và không có sự hỗ trợ nào Chúc shop sập tiệm Ugreen Đế Sạc Điện Thoại Không Dây Bằng Kim Loại Hít Nam Châm Cho Iphone 13 12 11 xs 2 1 2 125 126 127 128 129 DỊCH VỤ KHÁCH HÀNG Trung Tâm Trợ Giúp Shopee Shopee Blog Shopee Mall Hướng Dẫn Mua Hàng/Đặt Hàng Hướng Dẫn Bán Hàng Ví ShopeePay Shopee Xu Đơn Hàng Trả Hàng/Hoàn Tiền Liên Hệ Shopee Chính Sách Bảo Hành SHOPEE VIỆT NAM Về Shopee Tuyển Dụng Điều Khoản Shopee Chính Sách Bảo Mật Shopee Mall Kênh Người Bán Flash Sale Tiếp Thị Liên Kết Liên Hệ Truyền Thông THANH TOÁN ĐƠN VỊ VẬN CHUYỂN THEO DÕI SHOPEE Facebook Instagram LinkedIn TẢI ỨNG DỤNG SHOPEE © 2026 Shopee. Tất cả các quyền được bảo lưu. Quốc gia & Khu vực: Argentina Singapore Indonesia Thái Lan Malaysia Việt Nam Philippines Brazil México Đài Loan CHÍNH SÁCH BẢO MẬT QUY CHẾ HOẠT ĐỘNG CHÍNH SÁCH VẬN CHUYỂN CHÍNH SÁCH TRẢ HÀNG VÀ HOÀN TIỀN Công ty TNHH Shopee Địa chỉ: Tầng 4-5-6, Tòa nhà Capital Place, số 29 đường Liễu Giai, Phường Ngọc Hà, Thành phố Hà Nội, Việt Nam Chăm sóc khách hàng: Gọi tổng đài Shopee (miễn phí) hoặc Trò chuyện với Shopee ngay trên Trung tâm trợ giúp Chịu Trách Nhiệm Quản Lý Nội Dung: Nguyễn Bùi Anh Tuấn Mã số doanh nghiệp: 0106773786 do Sở Kế hoạch và Đầu tư TP Hà Nội cấp lần đầu ngày 10/02/2015 © 2015 - Bản quyền thuộc về Công ty TNHH Shopee 2",đúng với mô tả lừa đảo khong đổi bảo hành chất lượng san pham shop cố tình khong trả bảo hành mình đặt thêm 1 đơn hàng để report shop này mua cục sạc 65w chứ hết 12 tháng hỏng liên hệ shop hỗ trợ đồng ý đổi san pham mới để bảo hành mình đã cung cấp 2 video san pham khong lên điện và nhúng nước san pham để chắc chắn khong sử dụng duoc tuy nhiên shop gửi cho m 1 mã giảm giá giá trị san pham để đặt đơn hoàn nhưng khong sử dụng duoc sau khi liên hệ lai shop khẳng định mình đã sử dụng mã giảm giá rồi trong khi mình khong đặt và có liên hệ nhưng shop khong trả lời mình đã liên hệ cskh shopee xác nhận mã đơn shop gửi khong phải do mình đặt shop tiếp tục khong trả lời và khong có sự hỗ trợ nào chúc shop sập tiệm ugreen đế sạc điện thoại khong dây bằng kim loại hít nam châm cho iphone 13 12 11 xs 2 1 2 125 126 127 128 129 dịch vụ khách hàng trung tâm trợ giúp shopee shopee blog shopee mall hướng dẫn mua hàng đặt hàng hướng dẫn bán hàng ví shopeepay shopee xu đơn hàng trả hàng hoàn tiền liên hệ shopee chính sách bảo hành shopee việt nam về shopee tuyển dụng điều khoản shopee chính sách bảo mật shopee mall kênh người bán flash sale tiếp thị liên kết liên hệ truyền thông thanh toán đơn vị vận chuyển theo dõi shopee facebook instagram linkedin tải ứng dụng shopee 2026 shopee tất cả các quyền duoc bảo lưu quốc gia khu vực argentina singapore indonesia thái lan malaysia việt nam philippines brazil méxico đài loan chính sách bảo mật quy chế hoạt động chính sách vận chuyển chính sách trả hàng và hoàn tiền công ty tnhh shopee địa chỉ tầng 4 5 6 tòa nhà capital place số 29 đường liễu giai phường ngọc hà thành phố hà nội việt nam chăm sóc khách hàng gọi tổng đài shopee miễn phí hoặc trò chuyện với shopee ngay trên trung tâm trợ giúp chịu trách nhiệm quản lý nội dung nguyễn bùi anh tuấn mã số doanh nghiệp 0106773786 do sở kế hoạch và đầu tư tp hà nội cấp lần đầu ngày 10 02 2015 2015 bản quyền thuộc về công ty tnhh shopee 2,negative,negative,clear_negative_rule,seller_service,seller_service,1,khong tra loi,False,seller_service_priority_rule; clear_complaint_negative,reviewed_by_rule_and_context
shopee_issue_candidates (2).csv,129,"Tôi đã mua 6 con chuột ở đây, nhưng khi chuột có vấn đề nhắn hỏi shop về việc bảo hành thì gần như không phản hồi, chỉ yêu cầu quay phim lại. Chuột hỏng quay phim thì có ý nghĩa gì vậy shop, khách mà đã có ý gì thì người ta có thiếu gì cách làm cho chuột không chạy để quay. Cách trả lời khách hàng hết sức hời hợt thiếu trách nhiệm. Thôi từ sau khỏi mua, thiếu gì người bán mà phải ủng hộ cái shop thiếu trách nhiệm với khách hàng vậy.",tôi đã mua 6 con chuột ở đây nhưng khi chuột có vấn đề nhắn hỏi shop về việc bảo hành thì gần như khong phản hồi chỉ yêu cầu quay phim lại chuột hỏng quay phim thì có ý nghĩa gì vậy shop khách mà đã có ý gì thì người ta có thiếu gì cách làm cho chuột khong chạy để quay cách trả lời khách hàng hết sức hời hợt thiếu trách nhiệm thôi từ sau khỏi mua thiếu gì người bán mà phải ủng hộ cái shop thiếu trách nhiệm với khách hàng vậy,negative,negative,,seller_service,seller_service,1,khong phan hoi,False,seller_service_priority_rule; issue_candidate_default_negative,reviewed_by_rule_and_context
shopee_issue_candidates (2).csv,131,"Đóng gói cẩu thả, không có chống sốc khiến hàng về tới tay người dùng bị rách như này. Tuy không ảnh hưởng chất lượng nhưng shop cần lưu ý. Ugreen 20W USB C Sạc Nhanh PD 3.0 Sạc Tường Cắm Tương Thích Cho iPhone 16 Pro Max 14 Pro Max, Galaxy, Pixel 4 / 3, iPad Mini / Pro, Airpods Pro",đóng gói cẩu thả khong có chống sốc khiến hàng về tới tay người dùng bị rách như này tuy khong ảnh hưởng chất lượng nhưng shop cần lưu ý ugreen 20w usb c sạc nhanh pd 3 0 sạc tường cắm tương thích cho iphone 16 pro max 14 pro max galaxy pixel 4 3 ipad mini pro airpods pro,negative,negative,clear_negative_rule,packaging,packaging,1,khong co chong soc,False,packaging_priority_rule; clear_complaint_negative,reviewed_by_rule_and_context
shopee_issue_candidates (2).csv,132,"Chất lượng sản phẩm: chưa xài nên chưa biết mua làm quà tặng nhắn với shop gói kỹ giúp để tặng quà, shop bỏ vào mỗi hộp cartong mỏng, hàng tới hộp móp tan nát quá thất vọng 😢 Tai nghe Bluetooth không dây UGREEN Max5c 43dB Hybrid Active Khử tiếng ồn Hi-Res LDAC 75H Tai nghe chụp tai âm thanh không gian 2 n*****8",chất lượng san pham chua xài nên chua biết mua làm quà tặng nhắn với shop gói kỹ giúp để tặng quà shop bỏ vào mỗi hộp cartong mỏng hàng tới hộp móp tan nát quá thất vọng tai nghe bluetooth khong dây ugreen max5c 43db hybrid active khử tiếng ồn hi res ldac 75h tai nghe chụp tai âm thanh khong gian 2 n 8,negative,negative,clear_neutral_rule,packaging,packaging,1,hop mop,False,packaging_priority_rule; clear_complaint_negative,reviewed_by_rule_and_context
shopee_issue_candidates (2).csv,133,"Chất lượng nhận ban đầu trong 2 ngày đầu tốt. Không có chống sốc nhé Không có chống sốc nhé Sang 2 ngày thì cơ chế bấm mở lên cho dựng đứng mà hãng quảng cáo không hoạt động, tệ. Nhắn tin hỏi Cskh thì kêu trả hàng rồi thôi. Mà cận Tết nữa. Nên thôi, làm ăn rất chán rất rất chán. Không một câu nào chân thành. Tóm lại quá tệ quá tệ quá tệ cả nhà ưiiiiiiiiii 0:05 Bộ tuốc nơ vít từ tính 38 trong 1 UGREEN Universal để sửa chữa điện thoại di động 5 d*****1",chất lượng nhận ban đầu trong 2 ngày đầu tốt khong có chống sốc nhé khong có chống sốc nhé sang 2 ngày thì cơ chế bấm mở lên cho dựng đứng mà hãng quảng cáo khong hoạt động tệ nhắn tin hỏi cskh thì kêu trả hàng rồi thôi mà cận tết nữa nên thôi làm ăn rất chán rất rất chán khong một câu nào chân thành tóm lại quá tệ quá tệ quá tệ cả nhà ưiiiiiiiiii 0 05 bộ tuốc nơ vít từ tính 38 trong 1 ugreen universal để sửa chữa điện thoại di động 5 d 1,negative,negative,clear_negative_rule,packaging,packaging,1,khong co chong soc,False,packaging_priority_rule; clear_complaint_negative,reviewed_by_rule_and_context
shopee_issue_candidates (2).csv,134,"Shop làm ăn gian dối, banner sản phẩm ghi rõ 4 ổ AC nhưng khi giao hàng thì chỉ có 2 ổ AC, nhắn tin cho shop thì 1 2 ngày mới trả lời, đã gửi hình và video nhưng shop cứ bảo đúng sản phẩm, nhắn tin với shop mà cứ như với robot ấy, bạn nào có mua thì nhớ kiểm tra kĩ, không đúng thì trả hàng luôn chứ đừng nhắn tin cho shop rồi đợi trả lời như mình, hết luôn hạn hoàn tiền, cũng không giải quyết được gì 🥰 0:12 Bảng cắm ổ cắm UGREEN S6 Magic Cube với bảng cắm đa chức năng USB Trạm sạc máy tính để bàn đa cổng",shop làm ăn gian dối banner san pham ghi rõ 4 ổ ac nhưng khi giao hàng thì chỉ có 2 ổ ac nhắn tin cho shop thì 1 2 ngày mới trả lời đã gửi hình và video nhưng shop cứ bảo đúng san pham nhắn tin với shop mà cứ như với robot ấy bạn nào có mua thì nhớ kiểm tra kĩ khong đúng thì trả hàng luôn chứ đừng nhắn tin cho shop rồi đợi trả lời như mình hết luôn hạn hoàn tiền cũng khong giải quyết duoc gì 0 12 bảng cắm ổ cắm ugreen s6 magic cube với bảng cắm đa chức năng usb trạm sạc máy tính để bàn đa cổng,negative,negative,,seller_service,seller_service,1,khong giai quyet,False,seller_service_priority_rule; clear_complaint_negative,reviewed_by_rule_and_context
shopee_issue_candidates (2).csv,135,"Sản phẩm tệ, mới dùng không đã bị gãy phần chân đế đựng điện thoại, làm rơi điện thoại. Sản phẩm giá treo điện thoại xe máy nhưng liên hệ shop bảo không phù hợp với xe máy ? 0:12",san pham tệ mới dùng khong đã bị gãy phần chân đế đựng điện thoại làm rơi điện thoại san pham giá treo điện thoại xe máy nhưng liên hệ shop bảo khong phù hợp với xe máy 0 12,negative,negative,clear_negative_rule,product_quality,packaging,1,hop vo,False,product_quality_priority_rule; clear_complaint_negative,reviewed_by_rule_and_context
