source_file,page,review_text,cleaned_review,sentiment,model_sentiment,sentiment_rule,issue,issue_candidate,score,matched_patterns,needs_human_review,review_note,review_status
shopee_issue_candidates (1).csv,109,"Đơn hàng này mua mang thêm bực vào mình. Khi mua săn live được giá shock, đặt mua 3 thùng loại 46 gói giá khoảng 500k trừ các mã còn 423k nhưng khi nhận hàng thì là 3 thùng 30 gói, hỏi shop được trả lời là thùng 30 ( k hiểu vấn đề ở đâu mà đặt 46 thành 30 ). Mình hoàn hàng, shop đồng ý mà hoàn suốt, nhắc đi nhắc lại là đợi ship đến lấy, nhắc, hối hoài mà nửa tháng k thấy đến, hối cả shop, hối cả Shopee và sau là k lệch cho ship đến nhận và kiểu lừa đảo khách hàng để cho hết thời gian hoàn hàng phải nhận ý, bực k chịu nổi, đúng là kiểu lừa đảo mặc dù k đáng bao nhiêu. Mn đặt hàng bên shop, k nên thanh toán trước, hãy nhận đủ hàng mới thanh toán trách bị như mình nhé",đơn hàng này mua mang thêm bực vào mình khi mua săn live duoc giá shock đặt mua 3 thùng loại 46 gói giá khoảng 500k trừ các mã còn 423k nhưng khi nhận hàng thì là 3 thùng 30 gói hỏi shop duoc trả lời là thùng 30 khong hiểu vấn đề ở đâu mà đặt 46 thành 30 mình hoàn hàng shop đồng ý mà hoàn suốt nhắc đi nhắc lại là đợi ship đến lấy nhắc hối hoài mà nửa tháng khong thấy đến hối cả shop hối cả shopee và sau là khong lệch cho ship đến nhận và kiểu lừa đảo khách hàng để cho hết thời gian hoàn hàng phải nhận ý bực khong chịu nổi đúng là kiểu lừa đảo mặc dù khong đáng bao nhiêu moi nguoi đặt hàng bên shop khong nên thanh toán trước hãy nhận đủ hàng mới thanh toán trách bị như mình nhé,negative,negative,,product_quality,spam_irrelevant,1,minh hoa,False,product_quality_priority_rule; issue_candidate_default_negative,reviewed_by_rule_and_context
shopee_issue_candidates.csv,113,"Sản phẩm: Hàng lỗi hoặc bị hư hỏng Shop đóng gói sp quá tệ, Chai sữa tắm mà không bọc chống sốc hộp móp méo, Sản phẩm tràn hết ra ngoài, Mua hàng rất nhiều lần chưa gặp shop nào đóng gói ẩu như này",san pham hàng lỗi hoặc bị hư hỏng shop đóng gói san pham quá tệ chai sữa tắm mà khong bọc chống sốc hộp móp méo san pham tràn hết ra ngoài mua hàng rất nhiều lần chua gặp shop nào đóng gói ẩu như này,negative,negative,clear_negative_rule,packaging,packaging,1,hop mop,False,packaging_priority_rule; clear_complaint_negative,reviewed_by_rule_and_context
shopee_issue_candidates.csv,114,"Đóng gói ko cẩn thận , gộp đơn vô lí Thiếu hàng tặng kèm",đóng gói khong cẩn thận gộp đơn vô lí thiếu hàng tặng kèm,negative,negative,clear_negative_rule,wrong_missing_item,packaging,1,dong goi khong can than,False,wrong_missing_item_priority_rule; clear_complaint_negative,reviewed_by_rule_and_context
shopee_issue_candidates.csv,115,"Mall đóng hàng quá chán. Ko có bọc chống xốc j cả, để chai sữa tắm vào hộp to đùng. Nhận hàng hộp méo mó, rách tươm. Lần trước mua thì chai bị rò rỉ, lần này thì móp méo.",mall đóng hàng quá chán khong có bọc chống xốc j cả để chai sữa tắm vào hộp to đùng nhận hàng hộp méo mó rách tươm lần trước mua thì chai bị rò rỉ lần này thì móp méo,negative,negative,,packaging,packaging,1,hop meo,False,packaging_priority_rule; clear_complaint_negative,reviewed_by_rule_and_context
shopee_issue_candidates.csv,115,"Sản phẩm: Sản phẩm không như mô tả đã bảo huỷ đơn hàng đi rồi còn k chịu :)) ship đến thì hộp nát bét, chảy nhầy nhụa chất bên trong ra, đã thế còn gói chung đồ với sản phẩm khác làm t muốn huỷ hàng cũng khó. mọi lần mua ok nhưng mà lần này quá chán. chán nhất là chăm sóc khách hàng, ko chịu đọc tin nhắn của khách:))",san pham san pham khong như mô tả đã bảo huỷ đơn hàng đi rồi còn khong chịu ship đến thì hộp nát bét chảy nhầy nhụa chất bên trong ra đã thế còn gói chung đồ với san pham khác làm t muốn huỷ hàng cũng khó mọi lần mua ok nhưng mà lần này quá chán chán nhất là chăm sóc khách hàng khong chịu đọc tin nhắn của khách,negative,negative,,packaging,packaging,1,hop nat,False,packaging_priority_rule; clear_complaint_negative,reviewed_by_rule_and_context
shopee_issue_candidates.csv,116,"Shop làm ăn thất đức, giao thiếu 243k tiền hàng của mình nhưng nhất định không bù lại và cũng không chịu banking trả, mình nói rõ mình là sinh viên nhưng cũng éo muốn trả. Quá thất đức, Giao đến thì hộp rách nét méo mó đổ cả ra ngoài",shop làm ăn thất đức giao thiếu 243k tiền hàng của mình nhưng nhất định khong bù lại và cũng khong chịu banking trả mình nói rõ mình là sinh viên nhưng cũng éo muốn trả quá thất đức giao đến thì hộp rách nét méo mó đổ cả ra ngoài,negative,negative,,wrong_missing_item,packaging,1,hop rach,False,wrong_missing_item_priority_rule; clear_complaint_negative,reviewed_by_rule_and_context
shopee_issue_candidates.csv,116,Sp ko có hạn sử dụng. Nhắn tin shop thì ko trả lời. Trả hàng hoàn tiền thì shopee ko cho shipper đến nhận. Gọi hotline thì hẹn rồi im luôn. Tốt nhất ko nên mua. Shopee dạo này làm ăn quá tệ.,san pham khong có hạn sử dụng nhắn tin shop thì khong trả lời trả hàng hoàn tiền thì shopee khong cho shipper đến nhận gọi hotline thì hẹn rồi im luôn tốt nhất khong nên mua shopee dạo này làm ăn quá tệ,negative,negative,clear_negative_rule,seller_service,seller_service,1,khong tra loi,False,seller_service_priority_rule; clear_complaint_negative,reviewed_by_rule_and_context
shopee_issue_candidates (1).csv,113,"Đóng gói quá sơ sài, ￼ khi nhận hàng hộp móp méo, hở cả 3 hộp giấy rút bên trong. Cũng ko thấy miếng dán nam châm tặng kèm đâu, ko biết do rơi mất trong quá trình vận chuyển hay như nào 0:23",đóng gói quá sơ sài khi nhận hàng hộp móp méo hở cả 3 hộp giấy rút bên trong cũng khong thấy miếng dán nam châm tặng kèm đâu khong biết do rơi mất trong quá trình vận chuyển hay như nào 0 23,negative,negative,,packaging,packaging,1,hop mop,False,packaging_priority_rule; clear_complaint_negative,reviewed_by_rule_and_context
shopee_issue_candidates.csv,117,"Thiếu hàng khuyến mại, trả hàng thì mất thời gian.",thiếu hàng khuyến mại trả hàng thì mất thời gian,negative,negative,clear_negative_rule,wrong_missing_item,wrong_missing_item,1,thieu hang,False,wrong_missing_item_priority_rule; clear_complaint_negative,reviewed_by_rule_and_context
shopee_issue_candidates.csv,117,Rất tệ shop k.trả lời thắc mắc . hàng thì dán mã vạch k check dk,rất tệ shop khong trả lời thắc mắc hàng thì dán mã vạch khong check duoc,negative,negative,,seller_service,seller_service,1,khong tra loi,False,seller_service_priority_rule; clear_complaint_negative,reviewed_by_rule_and_context
shopee_issue_candidates.csv,118,"Bán hàng mà vừa giao sai hàng xong rồi chai sửa tắm mở ra có 1/2 chai là sao ạ, cả chai tặng cũng thế. Đặt loại này thì giao loại khác. Nhắn tin thì ko ai trả lời, ko bao giờ mua lần 2",bán hàng mà vừa giao sai hàng xong rồi chai sửa tắm mở ra có 1 2 chai là sao ạ cả chai tặng cũng thế đặt loại này thì giao loại khác nhắn tin thì khong ai trả lời khong bao giờ mua lần 2,negative,negative,clear_negative_rule,wrong_missing_item,wrong_missing_item,1,giao sai,False,wrong_missing_item_priority_rule; clear_complaint_negative,reviewed_by_rule_and_context
shopee_issue_candidates (1).csv,113,"Giao thiếu 1 gói, mua 30 gói nhưng giao chỉ có 29 gói",giao thiếu 1 gói mua 30 gói nhưng giao chỉ có 29 gói,negative,negative,,wrong_missing_item,wrong_missing_item,1,giao thieu,False,wrong_missing_item_priority_rule; clear_complaint_negative,reviewed_by_rule_and_context
shopee_issue_candidates (1).csv,115,Giao hàng chậm. Đặt từ ngày 4/10 đến 17/10 mới nhận được thùng catton bị rách móc treo thiếu 1 cái.,giao hàng chậm đặt từ ngày 4 10 đến 17 10 mới nhận duoc thùng catton bị rách móc treo thiếu 1 cái,negative,negative,clear_negative_rule,wrong_missing_item,shipping_delivery,1,giao hang cham,False,wrong_missing_item_priority_rule; clear_complaint_negative,reviewed_by_rule_and_context
shopee_issue_candidates (1).csv,124,Giao hàng chậm. Hàng đóng gói cẩu thả,giao hàng chậm hàng đóng gói cẩu thả,negative,negative,,shipping_delivery,shipping_delivery,1,giao hang cham,False,keep_candidate; issue_candidate_default_negative,reviewed_by_rule_and_context
shopee_issue_candidates (1).csv,125,Chất lượng sản phẩm: chất lượng đi xuống Tin dùng Topgia 4 năm rồi nhưng lần này phải đánh giá 1 sao thôi. Giấy mỏng hơn thùng cũ mình dùng. Bao bì cũng lạ. Đóng gói bao bì rách. Tệ quá tệ luôn. Chắc phải đổi hãng giấy khác thôi. Topgia làm ăn thế này thì mất khách hàng trung thành hết thôi 0:10,chất lượng san pham chất lượng đi xuống tin dùng topgia 4 năm rồi nhưng lần này phải đánh giá 1 sao thôi giấy mỏng hơn thùng cũ mình dùng bao bì cũng lạ đóng gói bao bì rách tệ quá tệ luôn chắc phải đổi hãng giấy khác thôi topgia làm ăn thế này thì mất khách hàng trung thành hết thôi 0 10,negative,negative,clear_negative_rule,packaging,packaging,1,bao bi rach,False,packaging_priority_rule; clear_complaint_negative,reviewed_by_rule_and_context
shopee_issue_candidates (1).csv,125,"Chất lượng sản phẩm: chất lượng sản phẩm tốt Dùng giấy topgia nhiều lần, tốt, lần này đóng gói hơi sơ sài. Giao thiếu 2 gói. 0:06",chất lượng san pham chất lượng san pham tốt dùng giấy topgia nhiều lần tốt lần này đóng gói hơi sơ sài giao thiếu 2 gói 0 06,negative,negative,,wrong_missing_item,wrong_missing_item,1,giao thieu,False,wrong_missing_item_priority_rule; clear_complaint_negative,reviewed_by_rule_and_context
shopee_issue_candidates.csv,125,"Như vậy có thể thấy bé 1 tuổi hoàn toàn có thể ăn gia vị như đường muối. Bên cạnh đó bé cũng có thể sử dụng các gia vị đến từ thiên nhiên như gừng, quế… Tuy nhiên mẹ cũng nên quan sát những cảm nhận của bé khi ăn thức ăn có gia vị để có thể điều chỉnh các món ăn phù hợp với sở thích của bé.",như vậy có thể thấy bé 1 tuổi hoàn toàn có thể ăn gia vị như đường muối bên cạnh đó bé cũng có thể sử dụng các gia vị đến từ thiên nhiên như gừng quế tuy nhiên mẹ cũng nên quan sát những cảm nhận của bé khi ăn thức ăn có gia vị để có thể điều chỉnh các món ăn phù hợp với sở thích của bé,negative,neutral,,packaging,packaging,1,hop vo,False,keep_candidate; issue_candidate_default_negative,reviewed_by_rule_and_context
shopee_issue_candidates.csv,126,"Kb giao thiếu hay đvvc khui trộm mà mình nhận về có 1 dầu gội trong khi mình đặt cả sữa tắm, mình phản hồi thì shopee xử thua k hiểu sao??? Nt cho shop thì k 1 lời phản hồi rõ ràng là cũng k muốn hỗ trợ trong khi thấy onl suốt. Thật uổng công mình tin tưởng mua shop khá nhiều đơn lý do hoàn cũng báo nghi bên vận chuyển lấy để k gây bất lợi cho shop nhưng với cách hành xử của shop này thì chắc là say bye thôi 👋 SHOP MALL NHƯNG KHÔNG UY TÍN",kb giao thiếu hay đvvc khui trộm mà mình nhận về có 1 dầu gội trong khi mình đặt cả sữa tắm mình phản hồi thì shopee xử thua khong hiểu sao nt cho shop thì khong 1 lời phản hồi rõ ràng là cũng khong muốn hỗ trợ trong khi thấy onl suốt thật uổng công mình tin tưởng mua shop khá nhiều đơn lý do hoàn cũng báo nghi bên vận chuyển lấy để khong gây bất lợi cho shop nhưng với cách hành xử của shop này thì chắc là say bye thôi shop mall nhưng khong uy tín,negative,negative,,wrong_missing_item,wrong_missing_item,1,giao thieu,False,wrong_missing_item_priority_rule; clear_complaint_negative,reviewed_by_rule_and_context
shopee_issue_candidates.csv,126,"Giao thiếu sp tặng, sp gói không kĩ bị móp méo chảy tùm lum , huỷ thì mắt công đợi tới đợi lui , cần hàng mà giao vậy, lần đầu tiên đánh giá 1 sao 😑",giao thiếu san pham tặng san pham gói khong kĩ bị móp méo chảy tùm lum huỷ thì mắt công đợi tới đợi lui cần hàng mà giao vậy lần đầu tiên đánh giá 1 sao,negative,negative,clear_negative_rule,wrong_missing_item,wrong_missing_item,1,giao thieu,False,wrong_missing_item_priority_rule; clear_complaint_negative,reviewed_by_rule_and_context
shopee_issue_candidates.csv,126,Phù hợp với loại da: phù hợp với da Mùi hương: bình thường Công dụng: làm sạch da bụi bẩn Giao hàng lâu quá tệ,phù hợp với loại da phù hợp với da mùi hương binh thuong công dụng làm sạch da bụi bẩn giao hàng lâu quá tệ,negative,neutral,clear_negative_rule,shipping_delivery,packaging,1,hop vo,False,shipping_delivery_priority_rule; clear_complaint_negative,reviewed_by_rule_and_context
shopee_issue_candidates.csv,127,"Đóng gói ko cẩn thận, để chảy ra mất nửa chai quà tặng",đóng gói khong cẩn thận để chảy ra mất nửa chai quà tặng,negative,negative,clear_negative_rule,packaging,packaging,1,dong goi khong can than,False,packaging_priority_rule; clear_complaint_negative,reviewed_by_rule_and_context
shopee_issue_candidates.csv,128,Phù hợp với loại da: ok Công dụng: ok Mùi hương: ok K có gì đáng nói ngoài qà tặng qá bịp,phù hợp với loại da ok công dụng ok mùi hương ok khong có gì đáng nói ngoài qà tặng qá bịp,negative,positive,,packaging,packaging,1,hop vo,False,keep_candidate; issue_candidate_default_negative,reviewed_by_rule_and_context
shopee_issue_candidates.csv,129,Mùi hương: ùm Công dụng: ùm Phù hợp với loại da: ùm không tặng quà 💔💔,mùi hương ùm công dụng ùm phù hợp với loại da ùm khong tặng quà,negative,neutral,,packaging,packaging,1,hop vo,False,keep_candidate; issue_candidate_default_negative,reviewed_by_rule_and_context
shopee_issue_candidates.csv,129,"Sản phẩm: Hàng lỗi hoặc bị hư hỏng Hàng bể chảy tè le mất nửa chai, nt cho shop thì shop yêu cầu video khui, mình có chụp ảnh gửi cho shop thì shop kêu xử lý 5-7 ngày xong đợi 10 ngày shop im re luôn, k đáng bao nhiêi nhưng thấy thất vọng về cách xử lý của shop",san pham hàng lỗi hoặc bị hư hỏng hàng bể chảy tè le mất nửa chai nt cho shop thì shop yêu cầu video khui mình có chụp ảnh gửi cho shop thì shop kêu xử lý 5 7 ngày xong đợi 10 ngày shop im re luôn khong đáng bao nhiêi nhưng thấy thất vọng về cách xử lý của shop,negative,negative,clear_negative_rule,seller_service,seller_service,1,shop im,False,seller_service_priority_rule; clear_complaint_negative,reviewed_by_rule_and_context
shopee_issue_candidates.csv,129,"Mua chai sữa tắm đợt trước xài thì chất nó đặc đặc , đợt này mua là chất gel . Hỏi shop thì auto tin nhắn tự động 1 đống . Bực cả mình ! Nay chất này mai chất kia ai biết hàng họ như thế nào . Shop uy tín cái qq ! 1 sao cũng k xứng đáng",mua chai sữa tắm đợt trước xài thì chất nó đặc đặc đợt này mua là chất gel hỏi shop thì auto tin nhắn tự động 1 đống bực cả mình nay chất này mai chất kia ai biết hàng họ như thế nào shop uy tín cái qq 1 sao cũng khong xứng đáng,negative,neutral,,price_value,price_value,1,khong xung,False,price_value_priority_rule; clear_complaint_negative,reviewed_by_rule_and_context
shopee_issue_candidates.csv,131,"Sữa tắm đổ tèm nhem, không lỡ dán băng dính vào miệng lọ nữa, k chống sốc gì cả, sợ",sữa tắm đổ tèm nhem khong lỡ dán băng dính vào miệng lọ nữa khong chống sốc gì cả sợ,negative,negative,,packaging,packaging,1,khong chong soc,False,packaging_priority_rule; clear_complaint_negative,reviewed_by_rule_and_context
shopee_issue_candidates.csv,131,Giao hàng bể vỡ chảy tùm lum mà không hỗ trợ đổi cho KH. Không dám mua ở đây nữa.,giao hàng bể vỡ chảy tùm lum mà khong hỗ trợ đổi cho khong khong dám mua ở đây nữa,negative,negative,,seller_service,seller_service,1,khong ho tro,False,seller_service_priority_rule; clear_complaint_negative,reviewed_by_rule_and_context
shopee_issue_candidates (1).csv,126,"Thiếu hàng , bung mất 1 thùng",thiếu hàng bung mất 1 thùng,negative,negative,clear_negative_rule,wrong_missing_item,wrong_missing_item,1,thieu hang,False,wrong_missing_item_priority_rule; clear_complaint_negative,reviewed_by_rule_and_context
shopee_issue_candidates.csv,133,"Shopeemall mà đóng hàng như cc, k chống sốc tí nào tràn rồi vỡ vòi hết ra",shopeemall mà đóng hàng như cc khong chống sốc tí nào tràn rồi vỡ vòi hết ra,negative,negative,,packaging,packaging,1,khong chong soc,False,packaging_priority_rule; clear_complaint_negative,reviewed_by_rule_and_context
shopee_issue_candidates (1).csv,128,Lần đầu mua của shop mà thất vọng . Hộp rách đã dành lại thiếu 1 gói hàng ngay trên cùng . Đánh giá cho shop 1 sao. Nếu đợi hoàn hàng sẽ rất lâu. Nên đành chấp nhận . Ko đáng bn nhưng thất vọng quá 0:45,lần đầu mua của shop mà thất vọng hộp rách đã dành lại thiếu 1 gói hàng ngay trên cùng đánh giá cho shop 1 sao nếu đợi hoàn hàng sẽ rất lâu nên đành chấp nhận khong đáng bn nhưng thất vọng quá 0 45,negative,negative,,packaging,packaging,1,hop rach,False,packaging_priority_rule; clear_complaint_negative,reviewed_by_rule_and_context
shopee_issue_candidates (1).csv,131,"gửi thiếu hàng, phản hồi lại thì mãi k thấy bù hàng",gửi thiếu hàng phản hồi lại thì mãi khong thấy bù hàng,negative,negative,clear_negative_rule,wrong_missing_item,wrong_missing_item,1,thieu hang,False,wrong_missing_item_priority_rule; clear_complaint_negative,reviewed_by_rule_and_context
shopee_issue_candidates.csv,135,"Phù hợp với loại da: mình bị dị ứng, chàm da do dùng này, bth k bị dùng xong bị, dừng phát 4,5 ngày sau thấy đỡ. Chê",phù hợp với loại da mình bị dị ứng chàm da do dùng này binh thuong khong bị dùng xong bị dừng phát 4 5 ngày sau thấy đỡ chê,neutral,neutral,clear_neutral_rule,packaging,packaging,1,hop vo,False,keep_candidate; neutral_or_not_used,reviewed_by_rule_and_context
shopee_issue_candidates (1).csv,134,Thiếu hàng. Thùng có 16 gói . tôi đặt 30 gói mà nhận được 16 là sao vậy shop 0:09,thiếu hàng thùng có 16 gói tôi đặt 30 gói mà nhận duoc 16 là sao vậy shop 0 09,negative,negative,clear_negative_rule,wrong_missing_item,wrong_missing_item,1,thieu hang,False,wrong_missing_item_priority_rule; clear_complaint_negative,reviewed_by_rule_and_context
shopee_issue_candidates.csv,137,"Giao lâu, đóng gói thì lỏng là lỏng lẻo, nhìn rất là cáu",giao lâu đóng gói thì lỏng là lỏng lẻo nhìn rất là cáu,negative,negative,clear_negative_rule,shipping_delivery,shipping_delivery,1,giao lau,False,shipping_delivery_priority_rule; clear_complaint_negative,reviewed_by_rule_and_context
shopee_issue_candidates.csv,137,Phù hợp với loại da: tất cả Công dụng: tắm Mùi hương: dịu shop k giiqr quà tặng kèm theo cho mình gì hết .những shop khác mua có tặng khăn .hộp bút .nước rửa tay mà mình k mua mình thấy shop tặng kem đánh răng mới mua .mà k gửi quà tặng .,phù hợp với loại da tất cả công dụng tắm mùi hương dịu shop khong giiqr quà tặng kèm theo cho mình gì hết những shop khác mua có tặng khăn hộp bút nước rửa tay mà mình khong mua mình thấy shop tặng kem đánh răng mới mua mà khong gửi quà tặng,negative,negative,,packaging,packaging,1,hop vo,False,keep_candidate; clear_complaint_negative,reviewed_by_rule_and_context
shopee_issue_candidates.csv,137,Đùa thương hiệu lớn gói hàng không chống sốc tí nào.,đùa thương hiệu lớn gói hàng khong chống sốc tí nào,negative,negative,,packaging,packaging,1,khong chong soc,False,packaging_priority_rule; clear_complaint_negative,reviewed_by_rule_and_context
shopee_issue_candidates (1).csv,137,"Chất lượng sản phẩm: kém giấy mỏng KHĂN RÚT TREO TƯỜNG‼️‼️ 👉👉 39k💰1túi Miễn ship tt đầm dơi, cầu xóm ruộng Cấu trúc giấy dày 4 lớp Thiết kế giấy rút treo tường tiện lợi, thuận tiện mỗi khi dùng Bên trên túi có các lỗ tròn treo tường, tiện lợi cho bạn bất cứ lúc nào. Sản phẩm mềm dai, mang đến cảm giác thoải mái khi lau chùi hoặc vệ sinh cá nhân. Gói bao gồm 320 tờ => SIÊU TIẾT KIỆM ....... Ps... chỉ coppy đánh giá đi nhận xu chứ không đúng như những j Quảng cáo đâu ạ... Shop đã gửi thiếu hàng mà hoàn trả shop lại không giải quyết 🙏🙏mat lòng tin 0:36",chất lượng san pham kém giấy mỏng khăn rút treo tường 39k 1túi miễn ship tt đầm dơi cầu xóm ruộng cấu trúc giấy dày 4 lớp thiết kế giấy rút treo tường tiện lợi thuận tiện mỗi khi dùng bên trên túi có các lỗ tròn treo tường tiện lợi cho bạn bất cứ lúc nào san pham mềm dai mang đến cảm giác thoải mái khi lau chùi hoặc vệ sinh cá nhân gói bao gồm 320 tờ siêu tiết kiệm ps chỉ coppy đánh giá đi nhận xu chứ khong đúng như những j quảng cáo đâu ạ shop đã gửi thiếu hàng mà hoàn trả shop lại khong giải quyết mat lòng tin 0 36,negative,negative,clear_negative_rule,wrong_missing_item,seller_service,1,khong giai quyet,False,wrong_missing_item_priority_rule; clear_complaint_negative,reviewed_by_rule_and_context
shopee_issue_candidates (1).csv,140,Có là hàng giảm giá thì cũng phải đóng gói đàng hoàng chứ ship cho ngươid ta mà cái hộp nát bét nhũn ra luôn v mà coi đc . Có tôn trọng khách hàng ko v?,có là hàng giảm giá thì cũng phải đóng gói đàng hoàng chứ ship cho ngươid ta mà cái hộp nát bét nhũn ra luôn v mà coi duoc có tôn trọng khách hàng khong v,negative,negative,,packaging,packaging,1,hop nat,False,packaging_priority_rule; issue_candidate_default_negative,reviewed_by_rule_and_context
shopee_issue_candidates.csv,140,Công dụng: được Phù hợp với loại da: đc Mùi hương: đc Giao hàng bị móp vỏ sản phẩm,công dụng duoc phù hợp với loại da duoc mùi hương duoc giao hàng bị móp vỏ san pham,negative,negative,clear_negative_rule,packaging,packaging,1,hop vo,False,keep_candidate; issue_candidate_default_negative,reviewed_by_rule_and_context
shopee_issue_candidates.csv,140,"Sản phẩm nhận nguyên vẹn, đơn thì giao lâu. Đặt nội thành HCM mà 6 ngày mới nhận được. Hãng nên làm việc lại với đvvc đi là vừa",san pham nhận nguyên vẹn đơn thì giao lâu đặt nội thành hcm mà 6 ngày mới nhận duoc hãng nên làm việc lại với đvvc đi là vừa,negative,neutral,clear_negative_rule,wrong_missing_item,shipping_delivery,1,giao lau,False,wrong_missing_item_priority_rule; clear_complaint_negative,reviewed_by_rule_and_context
shopee_issue_candidates.csv,142,"Giao sai hàng, mùi hương này k hề có trên flash sale mà shop cx cho vào bán",giao sai hàng mùi hương này khong hề có trên flash sale mà shop cx cho vào bán,negative,negative,clear_negative_rule,wrong_missing_item,wrong_missing_item,1,giao sai,False,wrong_missing_item_priority_rule; clear_complaint_negative,reviewed_by_rule_and_context
shopee_issue_candidates (1).csv,140,Đơn giang mua giấy ướt. Lại gửi giấy khô. Rồi ko cho hoàn hàng. Ko hỗ trợ,đơn giang mua giấy ướt lại gửi giấy khô rồi khong cho hoàn hàng khong hỗ trợ,negative,negative,,seller_service,seller_service,1,khong ho tro,False,seller_service_priority_rule; clear_complaint_negative,reviewed_by_rule_and_context
