review_text,sentiment_label,issue_label
Chất lượng sản phẩm: trời ơi thấy vọng thiệt chứ Đúng với mô tả: mong shop rep đánh giá Chưa lấy đc hàng Shipper ăn cắp hàng,negative,shipping_delivery
"bút đỏ viết không đẹp, mực ra đậm quá lâu khô nữa bút xanh đỡ hơn",negative,color_design
"Chất lượng sản phẩm: lỗi Đúng với mô tả: ko Sản phẩm: Sản phẩm không như mô tả, Hàng lỗi hoặc bị hư hỏng giao cho cái bút ngòi bị hỏng lên mình bỏ ra rồi cái bút có mấy nghìn lên th cũng chẳng thèm trả làm j🙂",negative,damaged_defective
"Giao thiếu hàng và sai luôn cả mẫu mã, shop uy tín mà không uy tín j cả, lần sau sẽ ko bao h quay lại shop này nữa",negative,wrong_missing_item
Chất lượng sản phẩm: có nhận dc đôu mờ Đúng với mô tả: hong bích tố cáo shipper lấy hàng của khách :((,negative,shipping_delivery
Đúng với mô tả: không đúng với mô tả trên ảnh shop là 1 hộp nhưng về chỉ là 1 cái mng nên chú ý khi mua hàng ạ,positive,packaging
Chất lượng sản phẩm: tệ Đúng với mô tả: không đúng với mô tả,negative,product_quality
"Cái bút mới về 1 ngày mà đứt cái ngòi luôn r má :))) k hiểu thế nào luôn, may là rẻ chứ k chắc tức chớt",negative,damaged_defective
Đúng với mô tả: tạm Chất lượng sản phẩm: tệ Ibyxrxtvubk8ubyctx527555ydrt hgyxxtyvubhnkbctv,negative,product_quality
Đúng với mô tả: không Ủa 1 hộp có 1 cây vạy ạ? Mua 5 hợp đc 5 cây 1 cây 10k à còn ship nữa Rất tệ,negative,packaging
Bút ngòi thì tắc mực dùng chán lắm k giải quyết đc thiếu hàng thiếu tièn cho mình shop lớn mà làm chán lắm không ra gì không đáng mua chê,negative,wrong_missing_item
Đúng với mô tả: ko Chất lượng sản phẩm: tệ Mực ko ra đều,negative,product_quality
"Chất lượng sản phẩm: khong tot Đúng với mô tả: bình thường Ngòi hay tắc mua năm cái tắc 3 rồi dùng gì nữa, hàng kém chất lượng thật sự lần sau sẽ không mua nữa",negative,damaged_defective
Chất lượng sản phẩm: đẹp nhưng đắt Đúng với mô tả: yessss Bút to hơi khó cầm viết k ra đều mực đã vậy còn bị nhem khi viết,negative,damaged_defective
vừa gai vừa tắc mực thất vọng,negative,no_issue
"Sản phẩm: Hàng lỗi hoặc bị hư hỏng Shop có dấu hiệu làm việc thiếu đạo đức, tiền thì thật mà sao cứ giao tào lao vậy? bút thì đặt 2 cây không cây nào có bọc đầu bút, lúc khui hàng còn thấy mực lem nhem và bị bấm lên để viết rồi, ghim ghi 200 cái nhưng thiếu 6 ghim nữa mới đủ 200. QUÁ THẤT VỌNG",negative,packaging
