page,issue_candidate,score,matched_patterns,review_text
98,price_value,1,"gia dat","Mua bên shop bị lỗi. Nt shop bảo hành. Shop cho mã giản giá đặt cái mới. Cái mới chân xạc hỏng. Nt shop hỏi lại thì bị chặn. Shop vớ vẩn 0:17"
99,price_value,1,"phi tien","Đúng với mô tả: không Chất lượng sản phẩm: không tốt 1 tí nào Quạt kiểu j í dùng được 1 tháng thì pin tụt siêu nhanh 1-2s tụt 1% , nhắn thì không rep trl đâu đâu í, đang dùng cố để sạc lại thì dùng đến 6 mấy % lại sập nguồn về 00%. Nói chung phí tiền vô cùng , dùng có 1th mà mấy trăm mấy. Khuyên mn ĐỪNG MUA . Quạt dỏm mà qc như đúng r. Bh mua r hối hận quá, bỏ tiền ra nhận lại quạt ko như mong đợi chán thật. Mn có cách sửa thì cmt hộ mik nha c.on. mik hỏi trên mạng thì ngta bảo lỗi này lỗi về pin 0:16"
101,seller_service,1,"thai do","Quạt bị hư pin, vừa sạc vừa quạt thì được. Rút dây sạc ra là im ru ko quạt được. Thái độ nhân viên chăm sóc thì bất cần khách hàng. Quá tệ, mặc dù mình đã mua mấy cái rồi. 0:09"
101,seller_service,2,"khong tra loi; khong giai quyet","Nhắn tin bảo hành không trả lời, không giải quyết vấn đề. Lấp lửng trong câu nói 0:08"
102,seller_service,1,"khong tra loi","Dịch vụ cskh quá tệ, máy lỗi mà nt k trả lời lại cứ vòng vo các thứ k trả lơic câu hỏi của khách, tệ 0:04"
103,seller_service,1,"khong tra loi","Sản phẩm: Sản phẩm không như mô tả Mình đặt shop quạt màu trắng nhưng khi giao về lại là màu đen mình nhắn shop mà shop không trả lời . 0:08"
105,seller_service,1,"khong phan hoi","Mua ngày 13/4 mà lâu lâu mới sd , cũng sạt đc 2,3 lần r . Nay đang xài bỗng cháy xì khói ra luôn . Nt shop hỏi bảo hành hay ntn shop ko phản hồi"
105,seller_service,1,"shop khong rep","Chất lượng sản phẩm: tệ Sản phẩm: Hàng lỗi hoặc bị hư hỏng sài xuống tới 27 là tự động tắt nhắn shop ko rep chỉ bt rep tự động thôi hay j nhân viên chảnh nghĩ sao để khách hàng đợi vậy shop lm ăn v là chết òi 0:05"
105,seller_service,1,"khong tra loi","Chất lượng sản phẩm: sp mở lên thì không chạy nhắn tin shop để hỗ trợ thì shop không trả lời khá thất vọng 0:14"
112,price_value,2,"phi tien; mua phi","Chán vô cùng như video k nên mua phí tiền 0:10"
116,seller_service,1,"shop khong rep","Gãy cách quạt nhắn shop ko rep"