page,issue_candidate,score,matched_patterns,review_text
1,price_value,2,"phi tien; mua phi","Chất lượng sản phẩm: rat te Đúng với mô tả: đúng dùng chua dc một tháng, nhanh het pin vãi sài chua đầy 1 tiếng đã hết . kh đáng mua , phí tiền 0:18"
2,seller_service,1,"khong giai quyet","quạt mua xài đúng 15 ngày đang chạy tự nhiên tắt xong sạc bật lên thử thì ko chạy còn nghe tiếng nổ ở trong rồi khói bốc mùi khét nữa không bao giờ sử dụng lại sản phẩm nhắn tin shop thì shop không giải quyết 0:09"
4,seller_service,1,"khong phan hoi","Chất lượng sản phẩm: ổn Giao hàng lâu, mua 2 cái màu trắng nhưng lại giao 2 cái màu đen, nhắn tin khiếu nại nhưng shop kh phản hồi, chất lượng ổn mà dịch vụ cskh cực kém 0:04"
6,seller_service,1,"thai do","Sản phẩm: Hàng lỗi hoặc bị hư hỏng Quạt mình mua đơn tầm 20 ngày, quạt không hoạt động, nhắn tin bảo hành shop rất quanh co, không rõ ràng, trả lời tin nhắn lâu. Mua quạt chưa thấy mát mà thấy bực. Câu chuyện vài ngày sau, Shop trơ trẽn lắm mn ơi. Trả lời khách thái độ cợt nhả, bắt mình sửa thành đánh giá 5 sao mới tặng coupon mua hàng mới. Shop tự hỏi xem lừa dối khách hàng vậy đáng giá 5 sao không, mà cũng nhắn vậy được? KHÔNG BẢO HÀNH hàng lỗi. Trăm ngàn lần mình chê thật sự. Lần đầu mua hàng gặp kiều CSKH, CS như này. Hi vọng shopee giải quyết mạnh tay với những shop như này. 0:11"
6,seller_service,1,"shop khong rep","Chất lượng sản phẩm: mình dùng được khoảng nửa tháng, đi quân sự trời nóng oi bức hy vọng mua quạt sẽ cải thiện được phần nào. nhưng thật sự rất tệ, quạt dùng được vài ngày thì hết pin nhanh kinh khủng, từ 100% trong 2 tiếng còn 70%. đỉnh điểm là ngày hôm nay, đang dùng thì kêu to tiếng, ù ù như máy cày ấy sau đó thì ko mát nữa. nhắn tin shop ko rep. đọc cmt của mọi người thì cũng ko hy vọng nhiều. đánh giá 1 sao khá ít, vì thật ra mọi người đánh giá 5 sao là do mới nhận hàng hoặc mới sử dụng vài hôm. mình mua từ 22 tháng 7, nhưng thật ra 28/7 mới bắt đầu dùng ( tính đến nay chưa được 2 tuần nhưng quạt đã phế lắm rồi) mong mọi người cân nhắc khi mua, mong shop làm ăn tử tế và giải quyết vấn đề. Sống mà tránh né? Hèn! 0:10"
9,seller_service,1,"khong ho tro","Quạt đang dùng bật khi gập thì tự động ngắt (cái quạt trước đây của tôi ko gặp tình trạng này), đã liên hệ nhưng shop trả lời ko đúng trọng tâm, ko hỗ trợ 0:16"
9,seller_service,1,"thai do","Sản phẩm: Hàng lỗi hoặc bị hư hỏng Hàng giao về đã sạc đầy mà bật k lên khi yêu cầu để giải quyết thì nhân viên k trl mà trl thì cũng k đâu vào đâu yêu cầu đổi hàng thì k cho cũng k trl tn thật sự là k tin đc 1 shop như này thái độ bán hàng lại tệ đến vậy , và đơn của mình vẫn ch đc giải quyết tôi cảm thấy mình đang bị khinh thường và bị shop k lịch sự trong khi mình là khách mà mình nt rất lịch sự trong khi shop lại trl tin của mình rất hời hợt và thiếu tôn trọng và mình muốn nói với shop khi đọc đc đánh giá này của mình là số tiền 200 nó k quá nhiều so với mình và khi shop trl tin mình lịch sự thì mình có thể bỏ qua những ở chuyện này thì shop làm mình thất vọng nhân viên thiếu lịch sự , văn minh và k coi trọng khách hàng thì mình cũng k lịch sự trong lần nói chuyện sau đâu 0:08"
10,price_value,1,"phi tien","Sản phẩm: Sản phẩm chất lượng kém, Sản phẩm không như mô tả, Hàng lỗi hoặc bị hư hỏng quạt sạc đầy pin mà bật lên chạy dc có 1h là hết pin. Nt cho shop để bảo hành ngay khi nhận và dùng quạt lần đầu mà shop kêu dùng lâu chai pin ko chịu bảo hành. Lừa đảo phí tiền rcm mn ko nên mua. 0:08"
10,seller_service,1,"thai do","Đúng với mô tả: dung Chất lượng sản phẩm: cầm nặng tay Sản phẩm: Hàng lỗi hoặc bị hư hỏng, Sản phẩm chất lượng kém Hazzz! Sp lỗi hư! Nt thì shop cũng hỗ trợ lại thái độ lồi lõm! Nói cung bảo hành mà bảo hành cho có! Bắt lấy vocher đặt lại sp khác trong ngày ! Zúng như mình mua 2 đơn zị đó! 0:04"
10,seller_service,1,"khong giai quyet","Sản phẩm: Hàng lỗi hoặc bị hư hỏng xài dc vài ba phút.K bao giờ sạc lên 100%.Bờ hôm 99% còn xài dc ít.Nay cả đêm 99% sáng dậy bật xuống 00%.Shop thì k giải quyết còn cứ đưa AI vào.Bức xúc"
10,seller_service,1,"khong giai quyet","Sản phẩm: Hàng lỗi hoặc bị hư hỏng Ch đc 1p tụt 5-6%, sài đc tí là sụp nguồn lấy hàng đc 10 ngày lỗi shop k chịu rep tn, k giải quyết. Tệ chất lượng tệ sự chuyên nghiệp khi buôn bán, hãng quạt lớn vậy giải quyết thì không chịu, k nên mua nhé!!! 0:10"
13,seller_service,1,"khong giai quyet","giao hàng thì sai màu, sợi dây đeo thì mất 1 bên dây móc. Nhắn tin để giải quyết thì cũng chả làm được gì ngoài gửi mấy cái vd quạt, cách móc dây vô quạt. Nhưng lại ko giải quyết được vấn đề:))"
13,seller_service,1,"khong phan hoi","Đúng với mô tả: tạm Chất lượng sản phẩm: tạm tr ơi chưa sài nhiu hết là quạt bị lỗi r. Nhắn bên shop kh ai trl. Mua về sạc bth tgian sau sạc pin cực kì nóng kh vô pin hiện pin ảo bó tay luôn. Cũng hơn 100 mấy chứ ít ỏi gì mà làm ăn kiểu gì ngộ thiệt. Ai mua đồ cũng trong chờ sản phẩm mang lại tốt nhất mà làm v bó tay r. Thất vọng. CỰC KÌ THẤT VỌNG VỀ SHOP KHI LÀM ĂN KHÁCH HÀNG IB KH PHẢN HỒI. CHỈ PHẢN HỒI THEO TN TỰ ĐỘNG 0:06"
14,seller_service,1,"thai do","Lỡ bấm nhầm màu kêu đổi dùm màu khác .nói là đổi rồi yên tâm .ship tới lại màu m k thích.ghét thái độ lừa dối khách hàng 0:04"
16,seller_service,1,"khong phan hoi","Mk đặt 1 cái trước xài OK đặt dùm bà c 2 cái đen này mà bị lỗi 1 cái gửi hình cho shop mà ko đc ?shop cũng ko phản hồi lại tin nhắn cho mk cảm thấy shop ko quan tâm và có trách nhiệm.làm mk giờ phải bỏ máy này vì ko lên nguồn buồn shop thật. 0:05"
17,seller_service,1,"khong ho tro","Sản phẩm: Hàng lỗi hoặc bị hư hỏng ĐỪNG MUA! ĐỪNG MUA! ĐỪNG MUA! ai có ý định mua thì đừng mua nha trời ơi. Giao buổi trưa bấm xài ok, tới chiều đem ra xài thì nó hết lên mình sợ nó hết pin cấm pin một hồi đó cháy khét lẹt lun. Hoàn Trả hàng thì shoppe ko hỗ trợ shipper tới , shop kêu đưa mình mã giảm giá cuối cùng mua cây khác cũng phải tốn 15k !!!. Làm Ăn Chán ko biết cây mới giao có xài được không hay tốn 15k nữa. 0:17"
17,seller_service,1,"khong giai quyet","Pin xạc không lên được 100% Shop không giải quyết vấn đề Đã mua hàng khác nhiều lần từ shop này, nhưng thất vọng"
18,seller_service,1,"khong tra loi","Sản phẩm: Hàng lỗi hoặc bị hư hỏng Quạt dùng chưa được 1 tuần hỏng bật không quay ,nhắn tin cb không trả lời lại tặng phiếu gg gì ? 0:19"
20,seller_service,1,"khong tra loi","Sản phẩm: Hàng lỗi hoặc bị hư hỏng, Sản phẩm chất lượng kém Thật sự chán với cách xử lý của shop , bạn bè xung quanh mình đều nói ok nên mình tin và đặt hàng , đến khi hàng về thì bạn mình đều xác nhận quạt bị rè ồn hơn cái của bạn mình , rồi mình nhắn shop thì trả lời sao chả hiểu luôn ,mình có nhắn hỏi đổi hàng được không thì không trả lời mình , shop thì nhắn nói mình khuấy vào cánh quạt 😊 còn hơn nồi cháo bá heo nữa ,chả biết khuấy làm sao. Nhắn tin hỏi Cà Mau mà trả lời Hà Nội . Mình chẳng có thời gian hay sự kiên nhẫn để chờ đợi shop đâu , thất vọng !! 0:36"
21,price_value,1,"khong xung","Chất lượng sản phẩm: quá tồi Chất lượng sản phẩm quá chán, mình mới mua sử dụng chưa đc tuần thì quạt có tình trang pin thì ảo, báo 80% nhưng chỉ sử dụng chứ trên video Quá thất vọng về sản phẩm , k xứng đáng 1 chút nào với số tiền bỏ ra 0:08"
22,price_value,1,"gia cao","1 cái hồng bật ko lên, 1 cái tím bật lên, nhỏ xíu, khả năng giá cao nhưng ko bền, dễ hư hỏng. Ko biết cái hư kia thì xử lý thế nào."
24,seller_service,1,"khong tra loi","Shop đóng gói cẩn thận , đơn vị giao hàng lâu , om hàng chục ngày mới giao cho khách , hỏi thì không trả lời"
26,price_value,1,"phi tien","Chất lượng sản phẩm: quá tệ Dùng đc đúng 1 lần thì quạt k chạy nữa, sạc cũng k vào pin, nhắn tin shop k rep, phí tiền 0:06"
27,seller_service,2,"khong ho tro; khong giai quyet","Chất lượng sản phẩm: kém Sản phẩm: Hàng lỗi hoặc bị hư hỏng, Sản phẩm chất lượng kém, Sản phẩm không như mô tả Pin tuột cực kì nhanh so với nhiều cây quạt cũng mua cùng hãng, nt shop k hỗ trợ bảo hành. Rất là CHÊ cái cách cskh luôn á. Đã k giải quyết, k hỗ trợ đc r nt còn tl hời hợt. Là lượt bán cao quá rồi nên mấy cái đánh giá 1 sao không là gì chứ gì?"
30,seller_service,1,"khong giai quyet","Chất lượng sản phẩm: chất lượng rất kém. vừa mua về đã hỏng ngay Đúng với mô tả: vừa mua về đã hỏng pin Sản phẩm: Sản phẩm chất lượng kém, Hàng lỗi hoặc bị hư hỏng Sản phẩm quá tệ. Shop hỗ trợ bằng AI rất khó chịu. Quạt vừa mua về đã hỏng. Sạc pin ko vào điện. Nhắn shop thì mãi mới trả lời lại cho AI trả lời không giải quyết đc vấn đề. rất khó chịu. Không nên mua. 0:08"
32,price_value,1,"phi tien","Sản phẩm: Sản phẩm không như mô tả Quạt vừa ồn vừa ko mát, sạc năng lượng mặt trời không dc. Tóm lại phí tiền. Mua nó vì tính năng sạc bằng năng lượng mặt trời. Mà phơi trực tiếp ngoài nắng lúc 10h30 trưa hong lên tí pin nào. Đã chấp nhận nó ồn, chỉ mong nó sạc được để đi chơi cho tiện mà hong dc. Tóm lại rước cục tức nó vào mình. Nhà có 3 cây quạt mini rồi, biết nó vô dụng vậy ai mua làm gì 1 n*****7"
36,seller_service,1,"thai do","Đúng với mô tả: ok Chất lượng sản phẩm: ko tệ lắm phần màn hình của quạt bị trầy xước khá nhiều, thái độ làm việc shop quá tệ, săn quạt đc 110k nhưng chỉ đòi hoàn cho khách voucher 10k, nhưng mà quạt cũng ổn, nhưng chưa bt lúc nào sẽ hư <: ( nếu đc thì né xa hãng này nhé mn )"
37,seller_service,1,"khong giai quyet","quạt thì mau hư, kh làm rớt, đụng chạm gì hết tự tắt nên mình nhắn cho shop thì shop rep lâu, không giải quyết được lằng nhằng hẳn 3 ngày, bắt mình tháo nắp tháo quạt xg cuối cùng vẫn k quay được. Sau đó bắt mình đánh giá 5 sao mới gửi mã để mua lại free? nói chung là tệ//////(27/3) ê đừng có xạo nha má đã nhắn câu nào đâu mà “ chủ động liên hệ “ 😒"
39,seller_service,1,"khong phan hoi","Chất lượng sản phẩm: kem Vô cùng tệ, chưa bật đã bị sập pin, nhăn tin ahop k phản hồi"
39,seller_service,1,"khong giai quyet","Sản phẩm: Sản phẩm không như mô tả, Sản phẩm chất lượng kém shop không giải quyết khiếu nại về giao sai mẫu. quá tệ sẽ k bao giờ mua lại lần tiếp theo. dù đac mua 3 cái ở shop"
39,seller_service,1,"khong giai quyet","Sài được 1 tháng bị lỗi, bật không lên, nhắn cho shop thì shop không giải quyết"
41,seller_service,1,"shop khong rep","Đúng với mô tả: tệ Chất lượng sản phẩm: hàng mới mua nhưng bị lỗi nhắn tin shop để đổi hàng nhưng shop kh rep Sản phẩm: Hàng lỗi hoặc bị hư hỏng"
41,seller_service,1,"thai do","Sản phẩm: Hàng lỗi hoặc bị hư hỏng Mua 2 cái quạt, 1c bị lỗi sạc k vào pin, rõ ràng đã vào nhưng 2 tiếng k lên 1 pin. Còn cái kia thì ổn, gửi tin nhắn sốp k rep thái độ"
43,seller_service,1,"khong tra loi","Sản phẩm: Hàng lỗi hoặc bị hư hỏng nhận hàng hộp còn nguyên vẹn ko rách nhưng khi mở quạt dùng thì quạt ko sử dụng được. mình liên hệ shop để hổ trơn đổi lại giúp mình thì shop ko trả lời mà chỉ nhắn shop hổ trơ phiếu giảm giá khi mua lại. trong khi mua 1 cái về bấm ko quạt đk lại hướng khách mua lại tặng phiếu giảm giá. shop làm ăn như vậy ko chấp nhận dk. chờ 2 ngày xem shop giải quyết thế nào mà ko được câu trả lời thích đáng nên mình đành đánh giá 1*"
44,seller_service,2,"khong giai quyet; thai do","Thái độ chăm sóc kh quá kém. Không giải quyết khi sp bị hư hỏng. Mọi người nên cẩn thận."
44,price_value,1,"phi tien","Quạt bật ko lên , sạc pin cũng ko vào điện , tưởng mua quạt như nào , phí tiền mua đồ hỏng . Mọi người cân nhắc rồi hãy mua nhà ."
48,seller_service,1,"khong tra loi","K tốt dùng chưa đc 1 tháng hỏng pin k xạc được phản hồi shop thoải quyết k tận tâm chậm phải tuỳ khách có ng biết dùng công nghệ người k cứ yêu cầu gửi video trong khi ng ta k biết cách gửi rồi lấy lý do là có video mới hỗ trợ trời k hư hỏng ng ta phản hồi khi Cá nhân mình sẽ k mua hàng của shop nữa hành chính hãng mà chưa hết bảo hành đã hỏng hỏi hỏng thì bảo hành chính hãng ở đâu k trả lời"
49,seller_service,1,"khong phan hoi","Chất lượng sản phẩm: hang lỗi Sản phẩm: Hàng lỗi hoặc bị hư hỏng Mua 2 cây 1 lỗi 1 ko, phản hồi shop nói gửi mã tặng 189k cho mình mua lại. Tới khi vào giỏ hàng mua, bt cây quạt đó mua 180 áp mã tạng shop mua lại ra 367k, tính ra trừ mã vẫn phải mua cây quạt đó 180k. Tính ra lừa đảo trắng trợn, cần phản hồi chonmn né shop này ra."
51,seller_service,1,"khong giai quyet","Chất lượng sản phẩm: Sài không dc ok lắm mới mua bị lỗi Mới mua về tuần đầu ok sai sau tuần bị lỗi yếu nt sop im re không giải quyết"
52,seller_service,1,"khong ho tro","Mình mua đi quân sự, dùng sang ngày thứ 2 bị tụt từ 80% xuống 0% một cách bất ngờ, 1 lần thì từ 30% xuống 0% luôn, chưa kể shop ghi sản phẩm dùng được trên 10 tiếng, mình dùng bthg cũng chỉ đc 3 tiếng đổ lại ở mức 40-60. Nhắn shop thì kiểu tránh vấn đề không hỗ trợ"
55,seller_service,1,"thai do","Sản phẩm: Hàng lỗi hoặc bị hư hỏng Shop cần xem lại thái độ và cách phàn hồi bên mình nha. Mình đã trả hàng sao shop k hoàn tiền vậy?"
55,price_value,1,"khong xung","Chất lượng sản phẩm: hàng kém chất lượng Đúng với mô tả: mua hàng về nhưng ko dùng đc Sản phẩm: Sản phẩm giả mạo, Sản phẩm chất lượng kém, Sản phẩm không như mô tả, Hàng lỗi hoặc bị hư hỏng ❌❌❌❌quạt ko dùng đc sạc ko lên pin màn hình ko hiển thị gì cả bấm nút ko lên . mọi ng cân nhắc thật kĩ trước khi mua nhé , đừng để bị lừa như mk mất tiền mà hàng về ko dùng đc . đáng lẽ ra là ko xứng đáng đc sao nào cả chứ đừng nói đến 1 sao. hàng tệ kém chất lượng . đây là đánh giá của mk trên cương vị của là ng bỏ tiền ra mua hàng"
59,seller_service,1,"khong tra loi","Sản phẩm: Hàng lỗi hoặc bị hư hỏng Mua về k sử dụng đc , nhắn tin k trả lời , làm ăn k đúng kém chất lượng thất vọng thực sự . Tiền mồ hôi nta mua về để nhận dc cái vô ich"
59,seller_service,1,"khong tra loi","Pin 100% sử dụng đc 40p hết pin Liên hệ chăm sóc khách hàng thì cũng không trả lời Quá tệ !"
59,seller_service,1,"thai do","Mình mua quạt của shop được tầm 1 tháng nhưng không sử dụng thường xuyên. Hôm nay mình mở quạt lên thì thấy quạt chạy khá yếu, mình thấy shop để bảo hành 6 tháng nên mình mới nhắn cho shop thì shop phản hồi mình như ảnh. Đó giờ chưa thấy shop nào kêu khách đập hư sản phẩm mới chịu giải quyết lại còn bảo đừng lãng phí thời gian trò chuyện. Mình tin tưởng mới nhắn cho shop để shop giải quyết thay vì đánh giá 1 sao nhưng thái độ kiểu đó thì 1 sao là đúng😔."
60,seller_service,1,"khong ho tro","Giao sai màu. Shop phản hồi chậm và hầu như k hỗ trợ phản hồi."
63,price_value,1,"phi tien","Sản phẩm: Hàng lỗi hoặc bị hư hỏng Mới dùng 1 tuần hỏng ko dùng được phí tiền , đồ đểu hàng tq hàng mã"
68,seller_service,1,"khong tra loi","Sản phẩm: Hàng lỗi hoặc bị hư hỏng, Sản phẩm chất lượng kém, Sản phẩm không như mô tả Quạt mình mua về lần 1 sạc vẫn lên mà đến nay sạc lần thứ 2 thì 2 tiếng rồi không lên 1% nào nhắn tin thì shop không trả lời, quá thất vọng làm ăn rất chán. Đến cái dây sạc còn bị hỏng, mình phải tự dùng dây sạc của mình"
69,seller_service,1,"khong ho tro","Sản phẩm: Hàng lỗi hoặc bị hư hỏng, Sản phẩm chất lượng kém Sạc không lên nhắn shop ko hỗ trợ 0:13"
70,seller_service,2,"khong ho tro; thai do","Sản phẩm: Hàng lỗi hoặc bị hư hỏng, Sản phẩm chất lượng kém Sử dụng được 3 lần thì pin hư, nhắn CSKH thái độ cực kì tệ. Chế độ bảo hành 6 tháng nhưng báo thì không hỗ trợ bảo hành. Mọi người cân nhắc"
70,seller_service,1,"khong tra loi","Sản phẩm: Sản phẩm không như mô tả, Hàng lỗi hoặc bị hư hỏng, Sản phẩm chất lượng kém đọc được mấy đánh giá 1 sao nma vẫn đặt nghĩ chắc mình khồng xui tới nỗi mà bị gửi quạt hỏng đâu, ai ngờ hỏng thật mà ntin shop thì shop khong trả lời …"
72,seller_service,1,"khong tra loi","Giao sai màu, nhắn tin shop không trả lời. Quạt bị rè"
73,seller_service,1,"thai do","Thái độ nhân viên không tốt. Mua quạt về mới sử dụng 2 lần thì cắm sạc không vào. Liên hệ shop thì shop bảo kiểm tra lại dây cáp chứ không nhắc đến lỗi sản phẩm cũng không nhắc đến việc đổi trả."
73,seller_service,1,"khong giai quyet","Đúng với mô tả: sản phẩm kh sạc được Chất lượng sản phẩm: shop rất rất tệ kh hề quan tâm đến những góp í của khách hàng và cũng kh giải quyết cho khách hàng"
74,price_value,1,"khong xung","Đúng với mô tả: không giống với chất liệu quạt mà ảnh shop quảng cáo Chất lượng sản phẩm: không mát diện tích phủ gió không nhiều .không tiện lợi .cầm mỏi tay .không mô tả ngay kích thước của quạt cùng với những thông tin khác trong ảnh giới thiệu sản phẩm. mình đã mua mã khác bên shop để so sánh và thấy với giá tiền rẻ hơn 40 k mã quạt khác có thể quay 360° tiện lợi hơn khi không cần lúc nào cũng phải cầm trên tay sức làm mát cũng tốt hơn. Những người xung quanh mình đều nói quạt không xứng đáng với giá tiền là 200k mà chỉ tầm50-100k thôi.mình thất vọng về sản phẩm này .Và sau này cũng sẽ không quay lại ủng hộ shop nữa . Sản phẩm: Sản phẩm không như mô tả Không đáng."
76,seller_service,1,"thai do","thái độ shop trả lời thiếu sự chuyên nghiệp giữa người mua hàng"
76,seller_service,1,"khong phan hoi","Sp lỗi nhắn shop thì ko phản hồi gì tốt 0 sao"
77,price_value,1,"phi tien","Quạt chạy rất yếu có bật mức quạt 100 đi nữa thì cx chỉ chạy bằng mức 1 kh có sự khác biệt Giao hàng thì đúng lâu phải đến 5-6 ngày ms nhận đc hàng Bỏ ra gần 200k mua cái quạt này rất là phí tiền"
80,seller_service,1,"khong tra loi","Mình đặt 2 chiếc giao 1 chiếc nhắn cskh thì xem k trả lời mắc mệt mất thời gian kinh"
82,seller_service,1,"khong giai quyet","Sản phẩm: Sản phẩm chất lượng kém Cáp sạc bị hỏng Sạc không lên điện, không lên pin Shop không giải quyết khiếu nại Đánh giá 1 sao"
86,seller_service,1,"khong giai quyet","Sản phẩm: Hàng lỗi hoặc bị hư hỏng, Sản phẩm giả mạo, Sản phẩm chất lượng kém, Sản phẩm không như mô tả Shop không giải quyết,hỗ trợ"
88,price_value,1,"gia cao","Nhỏ quá k mat giá cao nữa"
91,seller_service,1,"thai do","shop thái độ như qq, chửi khách nữa nhé^^ thái độ giải quyết hời hợt xong block khách luôn ạ. mua đâu chứ né shop này ra giùm nhe. vs quạt này dễ hư lắm nhé"
92,price_value,1,"phi tien","Chất lượng sản phẩm: quá tệ Đúng với mô tả: không hề Sản phẩm: Hàng lỗi hoặc bị hư hỏng, Sản phẩm không như mô tả, Sản phẩm chất lượng kém tôi nhận hàng từ 21/7, đến ngày hôm nay (20/8) là gần tròn 1 tháng tôi nhận hàng. trong 1 tháng tôi dùng chắc chắn chưa tới 10 lần nhưng sau mỗi lần dùng xong tôi đều sạc đầy để lần sau có thể tiện để dùng. trong những lần dùng tôi thấy rất khác so với quảng cáo là có thể dùng liên tiếp 2-3 tiếng khi mở chế độ 80-100, nhưng quạt của tôi lại hết pin rất nhanh. đỉnh điểm là sáng hôm nay tôi đã sạc đầy nhưng dùng chưa đầy 30p đã hết sạch điện khi tôi mới chỉ dùng chế độ 40. tôi cũng không nghĩ nhiều nên mang về sạc và khi đầy tôi rút ra luôn. lúc tối tôi bật lên dùng thì chưa đầy 15p nó đã tắt nguồn hết pin trong khi tôi mới sạc đầy khi nãy. shop giải quyết thế nào đây, các kol, koc khi quảng cáo sản phẩm này thế nào đây? người thì nói dùng bền lâu, bật vô tư chế độ to nhất có khi lên đến 3-4 tiếng nhưng trải nghiệm thực tế thì KHÔNG HỀ NHƯ CÁC BẠN, SHOP ĐÃ QUẢNG CÁO. TÔI RẤT THẤT VỌNG VÌ ĐÃ PHÍ TIỀN CHO MỘT SẢN PHẨM KHÔNG ĐÁNG! mn cân nhắc kĩ trước khi mua nhé! 0:19"
93,seller_service,1,"thai do","mới nhận hàng thấy nó bị hở, ib shop có phải bị lỗi k? shop tl là đền 12k mấy trăm đồng nếu k chịu sử dụng, k thì cứ sử dụng, k nói về vấn đề hàng lỗi hay k, ng mua k cần đòi 12k đó đâu, mình nói là mình ib để hỏi thiện chí shop tl nhìu câu nể thiệt. Giàu qúa Thì K Cần bán hàng onl đâu shop. mn cân nhắc khi mua shop này. mua hàng trên phiên Diệp Lê vì tin tưởng thôi chứ shop bán thái độ lồi lõm như này thì k quay lại. 0:22"
93,seller_service,2,"khong giai quyet; thai do","Sản phẩm: Hàng lỗi hoặc bị hư hỏng, Sản phẩm chất lượng kém Quá là chán thái độ của shop, nhắn phải hồi k biết bao nhiêu lần shop k hề có động tĩnh gì. Mua quạt này chủ yếu mình cần cái dây đeo cổ để làm việc bận k cầm được còn có dây, vậy mà ship về gãy luôn chổ bấm. Nhắn thì toàn tin nhắn tự động trả lời mấy ngày liên tục. K giải quyết vấn đề k đền dây mới lần đầu mua cũng như lần cuối làm ăn kiểu này ai mà mua lại nữa !!!!"
94,seller_service,2,"khong giai quyet; thai do","Gió: tốt Điều chỉnh tốc độ: điều chỉnh tăng đc nhưng k giảm đc Thiết kế: cầm chắc tay Sản phẩm: Hàng lỗi hoặc bị hư hỏng Mình mới nhận sp là nút giảm đã k xài đc . Nhắn tin cho shop thì k giải quyết đc j . Mong mọi người suy nghĩ kĩ trc khi mua nha. Thái độ shop tệ 0:18"
94,price_value,1,"khong xung","Đúng với mô tả: không Chất lượng sản phẩm: kém Sản phẩm: Hàng lỗi hoặc bị hư hỏng, Sản phẩm chất lượng kém, Sản phẩm không như mô tả màn hình hiển thị thì bị lỗi, pin cũng không dùng được lâu như shop quảng cáo. không xứng với giá tiền không nên mua 0:05"
98,price_value,1,"phi tien","Đã dùng thử gần tuần , 145k theo t là phí tiền . Pin ảo . Ko dùng cx tự hết"
